servi, s, e, r, v, i
servo, s, e, r, v, o
sesia, s, e, s, i, a
sessa, s, e, s, s, a
sesse, s, e, s, s, e
sessi, s, e, s, s, i
sesso, s, e, s, s, o
sesta, s, e, s, t, a
seste, s, e, s, t, e
sesti, s, e, s, t, i
sesto, s, e, s, t, o
setta, s, e, t, t, a
sette, s, e, t, t, e
setti, s, e, t, t, i
setto, s, e, t, t, o
sezzo, s, e, z, z, o
sfama, s, f, a, m, a
sfami, s, f, a, m, i
sfamo, s, f, a, m, o
sfara, s, f, a, r, a
sfare, s, f, a, r, e
sfaro, s, f, a, r, o
sfasa, s, f, a, s, a
sfasi, s, f, a, s, i
sfata, s, f, a, t, a
sfate, s, f, a, t, e
sfato, s, f, a, t, o
sfece, s, f, e, c, e
sfeci, s, f, e, c, i
sfera, s, f, e, r, a
sfere, s, f, e, r, e
sfida, s, f, i, d, a
sfide, s, f, i, d, e
sfidi, s, f, i, d, i
sfido, s, f, i, d, o
sfiga, s, f, i, g, a
sfila, s, f, i, l, a
sfili, s, f, i, l, i
sfilo, s, f, i, l, o
sfini, s, f, i, n, i
sfizi, s, f, i, z, i
sfoca, s, f, o, c, a
sfoci, s, f, o, c, i
sfoga, s, f, o, g, a
sfogo, s, f, o, g, o
sfora, s, f, o, r, a
sfori, s, f, o, r, i
sforo, s, f, o, r, o
sfuma, s, f, u, m, a
sfumi, s, f, u, m, i
sfumo, s, f, u, m, o
sfusa, s, f, u, s, a
sfuse, s, f, u, s, e
sfusi, s, f, u, s, i
sfuso, s, f, u, s, o
sgama, s, g, a, m, a
sgela, s, g, e, l, a
sgeli, s, g, e, l, i
sgelo, s, g, e, l, o
sghei, s, g, h, e, i
sgola, s, g, o, l, a
sgoli, s, g, o, l, i
sgolo, s, g, o, l, o
shake, s, h, a, k, e
share, s, h, a, r, e
shift, s, h, i, f, t
shirt, s, h, i, r, t
shock, s, h, o, c, k
short, s, h, o, r, t
shows, s, h, o, w, s
shunt, s, h, u, n, t
siamo, s, i, a, m, o
siano, s, i, a, n, o
siate, s, i, a, t, e
siche, s, i, c, h, e
sicli, s, i, c, l, i
siclo, s, i, c, l, o
sidri, s, i, d, r, i
sidro, s, i, d, r, o
sieda, s, i, e, d, a
siede, s, i, e, d, e
siedi, s, i, e, d, i
siedo, s, i, e, d, o
siena, s, i, e, n, a
siepe, s, i, e, p, e
siepi, s, i, e, p, i
sieri, s, i, e, r, i
siero, s, i, e, r, o
siete, s, i, e, t, e
sigla, s, i, g, l, a
sigle, s, i, g, l, e
sigli, s, i, g, l, i
siglo, s, i, g, l, o
sigma, s, i, g, m, a
sigmi, s, i, g, m, i
silfi, s, i, l, f, i
silfo, s, i, l, f, o
silla, s, i, l, l, a
silli, s, i, l, l, i
sillo, s, i, l, l, o
silos, s, i, l, o, s
silva, s, i, l, v, a
simia, s, i, m, i, a
simon, s, i, m, o, n
simun, s, i, m, u, n
sinai, s, i, n, a, i
sinus, s, i, n, u, s
siora, s, i, o, r, a
siore, s, i, o, r, e
siori, s, i, o, r, i
siria, s, i, r, i, a
sirio, s, i, r, i, o
sirma, s, i, r, m, a
sirme, s, i, r, m, e
sirte, s, i, r, t, e
sirti, s, i, r, t, i
sisal, s, i, s, a, l
sisma, s, i, s, m, a
sismi, s, i, s, m, i
sismo, s, i, s, m, o
sisto, s, i, s, t, o
sitar, s, i, t, a, r
situa, s, i, t, u, a
situi, s, i, t, u, i
situo, s, i, t, u, o
situs, s, i, t, u, s
sizio, s, i, z, i, o
sizza, s, i, z, z, a
skeet, s, k, e, e, t
skiff, s, k, i, f, f
skunk, s, k, u, n, k
slama, s, l, a, m, a
slamo, s, l, a, m, o
slams, s, l, a, m, s
slang, s, l, a, n, g
slava, s, l, a, v, a
slave, s, l, a, v, e
slavi, s, l, a, v, i
slavo, s, l, a, v, o
slebi, s, l, e, b, i
slebo, s, l, e, b, o
slega, s, l, e, g, a
slego, s, l, e, g, o
slice, s, l, i, c, e
slips, s, l, i, p, s
sloga, s, l, o, g, a
slogo, s, l, o, g, o
sloop, s, l, o, o, p
slums, s, l, u, m, s
slurp, s, l, u, r, p
smack, s, m, a, c, k
smaga, s, m, a, g, a
smani, s, m, a, n, i
smash, s, m, a, s, h
smina, s, m, i, n, a
smino, s, m, i, n, o
smise, s, m, i, s, e
smisi, s, m, i, s, i
smove, s, m, o, v, e
smura, s, m, u, r, a
smuro, s, m, u, r, o
snack, s, n, a, c, k
snell, s, n, e, l, l
sneva, s, n, e, v, a
snevo, s, n, e, v, o
snida, s, n, i, d, a
snidi, s, n, i, d, i
snido, s, n, i, d, o
sniff, s, n, i, f, f
snipe, s, n, i, p, e
snobs, s, n, o, b, s
snoda, s, n, o, d, a
snodi, s, n, o, d, i
snodo, s, n, o, d, o
snuda, s, n, u, d, a
snudo, s, n, u, d, o
soave, s, o, a, v, e
soavi, s, o, a, v, i
sobri, s, o, b, r, i
socca, s, o, c, c, a
socci, s, o, c, c, i
socco, s, o, c, c, o
socia, s, o, c, i, a
socie, s, o, c, i, e
socio, s, o, c, i, o
soddy, s, o, d, d, y
sodio, s, o, d, i, o
soffi, s, o, f, f, i
sofia, s, o, f, i, a
sogli, s, o, g, l, i
sogna, s, o, g, n, a
sogni, s, o, g, n, i
sogno, s, o, g, n, o
solai, s, o, l, a, i
solca, s, o, l, c, a
solco, s, o, l, c, o
soldi, s, o, l, d, i
soldo, s, o, l, d, o
solea, s, o, l, e, a
solee, s, o, l, e, e
solei, s, o, l, e, i
soleo, s, o, l, e, o
solfa, s, o, l, f, a
solfe, s, o, l, f, e
solfi, s, o, l, f, i
solfo, s, o, l, f, o
solli, s, o, l, l, i
sollo, s, o, l, l, o
solva, s, o, l, v, a
solve, s, o, l, v, e
solvi, s, o, l, v, i
somia, s, o, m, i, a
somma, s, o, m, m, a
somme, s, o, m, m, e
sommi, s, o, m, m, i
sommo, s, o, m, m, o
sonai, s, o, n, a, i
sonar, s, o, n, a, r
sonda, s, o, n, d, a
sonde, s, o, n, d, e
sondi, s, o, n, d, i
sondo, s, o, n, d, o
sonii, s, o, n, i, i
sonio, s, o, n, i, o
sonni, s, o, n, n, i
sonno, s, o, n, n, o
sopii, s, o, p, i, i
sopra, s, o, p, r, a
sorba, s, o, r, b, a
sorbe, s, o, r, b, e
sorbi, s, o, r, b, i
sorbo, s, o, r, b, o
sorca, s, o, r, c, a
sorci, s, o, r, c, i
sorda, s, o, r, d, a
sorde, s, o, r, d, e
sordi, s, o, r, d, i
sordo, s, o, r, d, o
sorel, s, o, r, e, l
sorga, s, o, r, g, a
sorge, s, o, r, g, e
sorgi, s, o, r, g, i
sorgo, s, o, r, g, o
sorra, s, o, r, r, a
sorre, s, o, r, r, e
sorse, s, o, r, s, e
sorsi, s, o, r, s, i
sorso, s, o, r, s, o
sorta, s, o, r, t, a
sorte, s, o, r, t, e
sorti, s, o, r, t, i
sorto, s, o, r, t, o
sosia, s, o, s, i, a
sosta, s, o, s, t, a
soste, s, o, s, t, e
sosti, s, o, s, t, i
sosto, s, o, s, t, o
sotto, s, o, t, t, o
sound, s, o, u, n, d
sovra, s, o, v, r, a
sozza, s, o, z, z, a
sozze, s, o, z, z, e
sozzi, s, o, z, z, i
sozzo, s, o, z, z, o
space, s, p, a, c, e
spada, s, p, a, d, a
spade, s, p, a, d, e
spagn, s, p, a, g, n
spago, s, p, a, g, o
spahi, s, p, a, h, i
spala, s, p, a, l, a
spali, s, p, a, l, i
spalo, s, p, a, l, o
spana, s, p, a, n, a
spani, s, p, a, n, i
spano, s, p, a, n, o
spara, s, p, a, r, a
spari, s, p, a, r, i
sparo, s, p, a, r, o
spata, s, p, a, t, a
spate, s, p, a, t, e
spati, s, p, a, t, i
spato, s, p, a, t, o
spazi, s, p, a, z, i
speck, s, p, e, c, k
speco, s, p, e, c, o
spedi, s, p, e, d, i
spela, s, p, e, l, a
speli, s, p, e, l, i
spelo, s, p, e, l, o
speme, s, p, e, m, e
spemi, s, p, e, m, i
spera, s, p, e, r, a
spere, s, p, e, r, e
speri, s, p, e, r, i
spero, s, p, e, r, o
spesa, s, p, e, s, a
spese, s, p, e, s, e
spesi, s, p, e, s, i
speso, s, p, e, s, o
spett, s, p, e, t, t
spiai, s, p, i, a, i
spica, s, p, i, c, a
spiga, s, p, i, g, a
spigo, s, p, i, g, o
spina, s, p, i, n, a
spine, s, p, i, n, e
spini, s, p, i, n, i
spino, s, p, i, n, o
spira, s, p, i, r, a
spire, s, p, i, r, e
spiri, s, p, i, r, i
spiro, s, p, i, r, o
spock, s, p, o, c, k
spola, s, p, o, l, a
spole, s, p, o, l, e
spone, s, p, o, n, e
spoon, s, p, o, o, n
spora, s, p, o, r, a
spore, s, p, o, r, e
sporo, s, p, o, r, o
sport, s, p, o, r, t
sposa, s, p, o, s, a
spose, s, p, o, s, e
sposi, s, p, o, s, i
sposo, s, p, o, s, o
spots, s, p, o, t, s
spray, s, p, r, a, y
sprue, s, p, r, u, e
spula, s, p, u, l, a
spuli, s, p, u, l, i
spulo, s, p, u, l, o
spuma, s, p, u, m, a
spume, s, p, u, m, e
spuri, s, p, u, r, i
sputa, s, p, u, t, a
sputi, s, p, u, t, i
sputo, s, p, u, t, o
squaw, s, q, u, a, w
stack, s, t, a, c, k
stadi, s, t, a, d, i
stael, s, t, a, e, l
staff, s, t, a, f, f
stage, s, t, a, g, e
staia, s, t, a, i, a
staio, s, t, a, i, o
stame, s, t, a, m, e
stami, s, t, a, m, i
stana, s, t, a, n, a
stand, s, t, a, n, d
stani, s, t, a, n, i
stano, s, t, a, n, o
stara, s, t, a, r, a
stare, s, t, a, r, e
stari, s, t, a, r, i
staro, s, t, a, r, o
stars, s, t, a, r, s
start, s, t, a, r, t
stasa, s, t, a, s, a
stasi, s, t, a, s, i
staso, s, t, a, s, o
stata, s, t, a, t, a
state, s, t, a, t, e
stati, s, t, a, t, i
stato, s, t, a, t, o
statu, s, t, a, t, u
stava, s, t, a, v, a
stavi, s, t, a, v, i
stavo, s, t, a, v, o
stazi, s, t, a, z, i
steca, s, t, e, c, a
stein, s, t, e, i, n
stele, s, t, e, l, e
steli, s, t, e, l, i
stelo, s, t, e, l, o
steno, s, t, e, n, o
steri, s, t, e, r, i
stero, s, t, e, r, o
stesa, s, t, e, s, a
stese, s, t, e, s, e
stesi, s, t, e, s, i
steso, s, t, e, s, o
stick, s, t, i, c, k
stico, s, t, i, c, o
stige, s, t, i, g, e
stigi, s, t, i, g, i
stila, s, t, i, l, a
stilb, s, t, i, l, b
stile, s, t, i, l, e
stili, s, t, i, l, i
stilo, s, t, i, l, o
stima, s, t, i, m, a
stime, s, t, i, m, e
stimi, s, t, i, m, i
stimo, s, t, i, m, o
stipa, s, t, i, p, a
stipe, s, t, i, p, e
stipi, s, t, i, p, i
stipo, s, t, i, p, o
stira, s, t, i, r, a
stiri, s, t, i, r, i
stiro, s, t, i, r, o
stiva, s, t, i, v, a
stive, s, t, i, v, e
stivi, s, t, i, v, i
stivo, s, t, i, v, o
stock, s, t, o, c, k
stola, s, t, o, l, a
stole, s, t, o, l, e
stoma, s, t, o, m, a
stomi, s, t, o, m, i
stona, s, t, o, n, a
stoni, s, t, o, n, i
stono, s, t, o, n, o
story, s, t, o, r, y
stria, s, t, r, i, a
strie, s, t, r, i, e
strip, s, t, r, i, p
studi, s, t, u, d, i
stufa, s, t, u, f, a
stufe, s, t, u, f, e
stufi, s, t, u, f, i
stufo, s, t, u, f, o
stuka, s, t, u, k, a
stupa, s, t, u, p, a
stupe, s, t, u, p, e
stura, s, t, u, r, a
sture, s, t, u, r, e
sturi, s, t, u, r, i
sturm, s, t, u, r, m
sturo, s, t, u, r, o
style, s, t, y, l, e
suasa, s, u, a, s, a
suase, s, u, a, s, e
suasi, s, u, a, s, i
suaso, s, u, a, s, o
subbi, s, u, b, b, i
subii, s, u, b, i, i
succo, s, u, c, c, o
sucre, s, u, c, r, e
sudai, s, u, d, a, i
sudan, s, u, d, a, n
sugge, s, u, g, g, e
suggi, s, u, g, g, i
sughi, s, u, g, h, i
sugli, s, u, g, l, i
sugna, s, u, g, n, a
sugne, s, u, g, n, e
suina, s, u, i, n, a
suine, s, u, i, n, e
suini, s, u, i, n, i
suino, s, u, i, n, o
suita, s, u, i, t, a
suite, s, u, i, t, e
sulky, s, u, l, k, y
sulla, s, u, l, l, a
sulle, s, u, l, l, e
sullo, s, u, l, l, o
summa, s, u, m, m, a
summe, s, u, m, m, e
sunna, s, u, n, n, a
sunne, s, u, n, n, e
sunti, s, u, n, t, i
sunto, s, u, n, t, o
suola, s, u, o, l, a
suole, s, u, o, l, e
suoli, s, u, o, l, i
suolo, s, u, o, l, o
suona, s, u, o, n, a
suone, s, u, o, n, e
suoni, s, u, o, n, i
suono, s, u, o, n, o
suora, s, u, o, r, a
suore, s, u, o, r, e
super, s, u, p, e, r
supra, s, u, p, r, a
surah, s, u, r, a, h
surra, s, u, r, r, a
sussi, s, u, s, s, i
susta, s, u, s, t, a
suste, s, u, s, t, e
sutra, s, u, t, r, a
sutri, s, u, t, r, i
suvvi, s, u, v, v, i
svaga, s, v, a, g, a
svago, s, v, a, g, o
svani, s, v, a, n, i
svasa, s, v, a, s, a
svasi, s, v, a, s, i
svaso, s, v, a, s, o
svela, s, v, e, l, a
sveli, s, v, e, l, i
svelo, s, v, e, l, o
svena, s, v, e, n, a
sveno, s, v, e, n, o
sveva, s, v, e, v, a
sveve, s, v, e, v, e
svevi, s, v, e, v, i
svevo, s, v, e, v, o
sviai, s, v, i, a, i
svili, s, v, i, l, i
svina, s, v, i, n, a
svino, s, v, i, n, o
svisa, s, v, i, s, a
svisi, s, v, i, s, i
sviso, s, v, i, s, o
svita, s, v, i, t, a
sviti, s, v, i, t, i
svito, s, v, i, t, o
svizi, s, v, i, z, i
svola, s, v, o, l, a
svolo, s, v, o, l, o
sweet, s, w, e, e, t
swift, s, w, i, f, t
swing, s, w, i, n, g
tabla, t, a, b, l, a
tacca, t, a, c, c, a
tacce, t, a, c, c, e
tacci, t, a, c, c, i
tacco, t, a, c, c, o
tachi, t, a, c, h, i
tactu, t, a, c, t, u
taffi, t, a, f, f, i
tagal, t, a, g, a, l
tagli, t, a, g, l, i
taide, t, a, i, d, e
taiga, t, a, i, g, a
taine, t, a, i, n, e
taira, t, a, i, r, a
talco, t, a, l, c, o
talea, t, a, l, e, a
taled, t, a, l, e, d
talee, t, a, l, e, e
talli, t, a, l, l, i
tallo, t, a, l, l, o
talpa, t, a, l, p, a
talpe, t, a, l, p, e
tamia, t, a, m, i, a
tamil, t, a, m, i, l
tanca, t, a, n, c, a
tanfi, t, a, n, f, i
tanfo, t, a, n, f, o
tanga, t, a, n, g, a
tange, t, a, n, g, e
tango, t, a, n, g, o
tanna, t, a, n, n, a
tanno, t, a, n, n, o
tanta, t, a, n, t, a
tante, t, a, n, t, e
tanti, t, a, n, t, i
tanto, t, a, n, t, o
tapis, t, a, p, i, s
tappa, t, a, p, p, a
tappe, t, a, p, p, e
tappi, t, a, p, p, i
tappo, t, a, p, p, o
tarai, t, a, r, a, i
tarda, t, a, r, d, a
tarde, t, a, r, d, e
tardi, t, a, r, d, i
tardo, t, a, r, d, o
targa, t, a, r, g, a
targo, t, a, r, g, o
tarla, t, a, r, l, a
tarle, t, a, r, l, e
tarli, t, a, r, l, i
tarlo, t, a, r, l, o
tarma, t, a, r, m, a
tarme, t, a, r, m, e
tarpa, t, a, r, p, a
tarpi, t, a, r, p, i
tarpo, t, a, r, p, o
tarsi, t, a, r, s, i
tarso, t, a, r, s, o
tasca, t, a, s, c, a
tassa, t, a, s, s, a
tasse, t, a, s, s, e
tassi, t, a, s, s, i
tasso, t, a, s, s, o
tasta, t, a, s, t, a
taste, t, a, s, t, e
tasti, t, a, s, t, i
tasto, t, a, s, t, o
tatti, t, a, t, t, i
tatto, t, a, t, t, o
tatua, t, a, t, u, a
tatui, t, a, t, u, i
tatuo, t, a, t, u, o
tauri, t, a, u, r, i
tauro, t, a, u, r, o
tauto, t, a, u, t, o
taxis, t, a, x, i, s
taxon, t, a, x, o, n
tazza, t, a, z, z, a
tazze, t, a, z, z, e
teams, t, e, a, m, s
teano, t, e, a, n, o
tebea, t, e, b, e, a
tebee, t, e, b, e, e
tebei, t, e, b, e, i
tebeo, t, e, b, e, o
tecca, t, e, c, c, a
teche, t, e, c, h, e
tecla, t, e, c, l, a
tecno, t, e, c, n, o
teddy, t, e, d, d, y
tedia, t, e, d, i, a
tedio, t, e, d, i, o
tegea, t, e, g, e, a
teghe, t, e, g, h, e
teina, t, e, i, n, a
teine, t, e, i, n, e
telai, t, e, l, a, i
telex, t, e, l, e, x
telos, t, e, l, o, s
temei, t, e, m, e, i
tempi, t, e, m, p, i
tempo, t, e, m, p, o
tenar, t, e, n, a, r
tenda, t, e, n, d, a
tende, t, e, n, d, e
tendi, t, e, n, d, i
tendo, t, e, n, d, o
tenei, t, e, n, e, i
tenga, t, e, n, g, a
tengo, t, e, n, g, o
tenia, t, e, n, i, a
tenie, t, e, n, i, e
tenne, t, e, n, n, e
tenni, t, e, n, n, i
tenno, t, e, n, n, o
tenor, t, e, n, o, r
tensa, t, e, n, s, a
tense, t, e, n, s, e
tenta, t, e, n, t, a
tenti, t, e, n, t, i
tento, t, e, n, t, o
tenue, t, e, n, u, e
tenui, t, e, n, u, i
tepee, t, e, p, e, e
teppa, t, e, p, p, a
teppe, t, e, p, p, e
terbi, t, e, r, b, i
terga, t, e, r, g, a
terge, t, e, r, g, e
tergi, t, e, r, g, i
tergo, t, e, r, g, o
terio, t, e, r, i, o
terme, t, e, r, m, e
termi, t, e, r, m, i
termo, t, e, r, m, o
terna, t, e, r, n, a
terne, t, e, r, n, e
terni, t, e, r, n, i
terno, t, e, r, n, o
terra, t, e, r, r, a
terre, t, e, r, r, e
terro, t, e, r, r, o
tersa, t, e, r, s, a
terse, t, e, r, s, e
tersi, t, e, r, s, i
terso, t, e, r, s, o
terza, t, e, r, z, a
terze, t, e, r, z, e
terzi, t, e, r, z, i
terzo, t, e, r, z, o
teseo, t, e, s, e, o
tesla, t, e, s, l, a
tespi, t, e, s, p, i
tessa, t, e, s, s, a
tesse, t, e, s, s, e
tessi, t, e, s, s, i
tesso, t, e, s, s, o
testa, t, e, s, t, a
teste, t, e, s, t, e
testi, t, e, s, t, i
testo, t, e, s, t, o
tests, t, e, s, t, s
tetra, t, e, t, r, a
tetre, t, e, t, r, e
tetri, t, e, t, r, i
tetro, t, e, t, r, o
tetta, t, e, t, t, a
tette, t, e, t, t, e
tetti, t, e, t, t, i
tetto, t, e, t, t, o
texas, t, e, x, a, s
theta, t, h, e, t, a
tiade, t, i, a, d, e
tiadi, t, i, a, d, i
tiara, t, i, a, r, a
tiare, t, i, a, r, e
tiaso, t, i, a, s, o
tibet, t, i, b, e, t
tibia, t, i, b, i, a
tibie, t, i, b, i, e
tideo, t, i, d, e, o
tiene, t, i, e, n, e
tieni, t, i, e, n, i
tifai, t, i, f, a, i
tifeo, t, i, f, e, o
tiflo, t, i, f, l, o
tiggi, t, i, g, g, i
tight, t, i, g, h, t
tigli, t, i, g, l, i
tigna, t, i, g, n, a
tigne, t, i, g, n, e
tigra, t, i, g, r, a
tigre, t, i, g, r, e
tigri, t, i, g, r, i
tigro, t, i, g, r, o
tilde, t, i, l, d, e
tildi, t, i, l, d, i
tilla, t, i, l, l, a
tille, t, i, l, l, e
timeo, t, i, m, e, o
timer, t, i, m, e, r
timor, t, i, m, o, r
timpa, t, i, m, p, a
timpe, t, i, m, p, e
tinca, t, i, n, c, a
tinga, t, i, n, g, a
tinge, t, i, n, g, e
tingi, t, i, n, g, i
tingo, t, i, n, g, o
tinni, t, i, n, n, i
tinse, t, i, n, s, e
tinsi, t, i, n, s, i
tinta, t, i, n, t, a
tinte, t, i, n, t, e
tinti, t, i, n, t, i
tinto, t, i, n, t, o
tirai, t, i, r, a, i
tiran, t, i, r, a, n
tirsi, t, i, r, s, i
tirso, t, i, r, s, o
tisbe, t, i, s, b, e
tisia, t, i, s, i, a
tizia, t, i, z, i, a
tizie, t, i, z, i, e
tizio, t, i, z, i, o
tizzi, t, i, z, z, i
tizzo, t, i, z, z, o
tmesi, t, m, e, s, i
toast, t, o, a, s, t
tobia, t, o, b, i, a
tocai, t, o, c, a, i
tocca, t, o, c, c, a
tocco, t, o, c, c, o
tochi, t, o, c, h, i
toghe, t, o, g, h, e
toghi, t, o, g, h, i
togli, t, o, g, l, i
tokai, t, o, k, a, i
tokaj, t, o, k, a, j
token, t, o, k, e, n
tokio, t, o, k, i, o
tolda, t, o, l, d, a
tolde, t, o, l, d, e
tolfa, t, o, l, f, a
tolga, t, o, l, g, a
tolgo, t, o, l, g, o
tolla, t, o, l, l, a
tolle, t, o, l, l, e
tolse, t, o, l, s, e
tolsi, t, o, l, s, i
tolta, t, o, l, t, a
tolte, t, o, l, t, e
tolti, t, o, l, t, i
tolto, t, o, l, t, o
tomai, t, o, m, a, i
tomba, t, o, m, b, a
tombe, t, o, m, b, e
tombo, t, o, m, b, o
tomia, t, o, m, i, a
tonda, t, o, n, d, a
tonde, t, o, n, d, e
tondi, t, o, n, d, i
tondo, t, o, n, d, o
toner, t, o, n, e, r
tonfa, t, o, n, f, a
tonfi, t, o, n, f, i
tonfo, t, o, n, f, o
tonia, t, o, n, i, a
tonne, t, o, n, n, e
tonni, t, o, n, n, i
tonno, t, o, n, n, o
tonta, t, o, n, t, a
tonte, t, o, n, t, e
tonti, t, o, n, t, i
tonto, t, o, n, t, o
topoi, t, o, p, o, i
topos, t, o, p, o, s
toppa, t, o, p, p, a
toppe, t, o, p, p, e
toppi, t, o, p, p, i
toppo, t, o, p, p, o
toque, t, o, q, u, e
torah, t, o, r, a, h
torba, t, o, r, b, a
torbe, t, o, r, b, e
torbi, t, o, r, b, i
torbo, t, o, r, b, o
torca, t, o, r, c, a
torce, t, o, r, c, e
torci, t, o, r, c, i
torco, t, o, r, c, o
tordi, t, o, r, d, i
tordo, t, o, r, d, o
torea, t, o, r, e, a
toreo, t, o, r, e, o
torio, t, o, r, i, o
torli, t, o, r, l, i
torlo, t, o, r, l, o
torma, t, o, r, m, a
torme, t, o, r, m, e
torna, t, o, r, n, a
torni, t, o, r, n, i
torno, t, o, r, n, o
toron, t, o, r, o, n
torre, t, o, r, r, e
torri, t, o, r, r, i
torse, t, o, r, s, e
torsi, t, o, r, s, i
torso, t, o, r, s, o
torta, t, o, r, t, a
torte, t, o, r, t, e
torti, t, o, r, t, i
torto, t, o, r, t, o
torva, t, o, r, v, a
torve, t, o, r, v, e
torvi, t, o, r, v, i
torvo, t, o, r, v, o
tosai, t, o, s, a, i
tosca, t, o, s, c, a
tosco, t, o, s, c, o
tossa, t, o, s, s, a
tosse, t, o, s, s, e
tossi, t, o, s, s, i
tosso, t, o, s, s, o
tosta, t, o, s, t, a
toste, t, o, s, t, e
tosti, t, o, s, t, i
tosto, t, o, s, t, o
totem, t, o, t, e, m
totip, t, o, t, i, p
tours, t, o, u, r, s
tozza, t, o, z, z, a
tozze, t, o, z, z, e
tozzi, t, o, z, z, i
tozzo, t, o, z, z, o
trace, t, r, a, c, e
traci, t, r, a, c, i
trade, t, r, a, d, e
tradi, t, r, a, d, i
trago, t, r, a, g, o
trait, t, r, a, i, t
trama, t, r, a, m, a
trame, t, r, a, m, e
trami, t, r, a, m, i
tramo, t, r, a, m, o
tramp, t, r, a, m, p
trani, t, r, a, n, i
trans, t, r, a, n, s
trave, t, r, a, v, e
travi, t, r, a, v, i
trawl, t, r, a, w, l
trema, t, r, e, m, a
tremi, t, r, e, m, i
tremo, t, r, e, m, o
trend, t, r, e, n, d
treni, t, r, e, n, i
treno, t, r, e, n, o
treti, t, r, e, t, i
treto, t, r, e, t, o
trevi, t, r, e, v, i
trevo, t, r, e, v, o
trial, t, r, i, a, l
trias, t, r, i, a, s
tribu, t, r, i, b, u
trico, t, r, i, c, o
triga, t, r, i, g, a
trina, t, r, i, n, a
trine, t, r, i, n, e
trini, t, r, i, n, i
trino, t, r, i, n, o
trips, t, r, i, p, s
trita, t, r, i, t, a
trite, t, r, i, t, e
triti, t, r, i, t, i
trito, t, r, i, t, o
trivi, t, r, i, v, i
trizi, t, r, i, z, i
trofi, t, r, o, f, i
trofo, t, r, o, f, o
troia, t, r, o, i, a
troie, t, r, o, i, e
troll, t, r, o, l, l
troni, t, r, o, n, i
trono, t, r, o, n, o
tropi, t, r, o, p, i
tropo, t, r, o, p, o
trota, t, r, o, t, a
trote, t, r, o, t, e
trova, t, r, o, v, a
trovi, t, r, o, v, i
trovo, t, r, o, v, o
truca, t, r, u, c, a
truce, t, r, u, c, e
truci, t, r, u, c, i
truck, t, r, u, c, k
truka, t, r, u, k, a
trumo, t, r, u, m, o
trust, t, r, u, s, t
ttero, t, t, e, r, o
tubai, t, u, b, a, i
tucul, t, u, c, u, l
tuffa, t, u, f, f, a
tuffi, t, u, f, f, i
tuffo, t, u, f, f, o
tughe, t, u, g, h, e
tulio, t, u, l, i, o
tulle, t, u, l, l, e
tuner, t, u, n, e, r
tuona, t, u, o, n, a
tuoni, t, u, o, n, i
tuono, t, u, o, n, o
tupac, t, u, p, a, c
tuppe, t, u, p, p, e
turai, t, u, r, a, i
turba, t, u, r, b, a
turbe, t, u, r, b, e
turbi, t, u, r, b, i
turbo, t, u, r, b, o
turca, t, u, r, c, a
turco, t, u, r, c, o
turfa, t, u, r, f, a
turfe, t, u, r, f, e
turge, t, u, r, g, e
turku, t, u, r, k, u
turma, t, u, r, m, a
turme, t, u, r, m, e
turna, t, u, r, n, a
turni, t, u, r, n, i
turno, t, u, r, n, o
turpe, t, u, r, p, e
turpi, t, u, r, p, i
tutta, t, u, t, t, a
tutte, t, u, t, t, e
tutti, t, u, t, t, i
tutto, t, u, t, t, o
tuzia, t, u, z, i, a
tuzie, t, u, z, i, e
tweed, t, w, e, e, d
twill, t, w, i, l, l
twist, t, w, i, s, t
typon, t, y, p, o, n
ubbia, u, b, b, i, a
ubbie, u, b, b, i, e
ubere, u, b, e, r, e
uberi, u, b, e, r, i
ubero, u, b, e, r, o
udine, u, d, i, n, e
udira, u, d, i, r, a
udire, u, d, i, r, e
udiro, u, d, i, r, o
udita, u, d, i, t, a
udite, u, d, i, t, e
uditi, u, d, i, t, i
udito, u, d, i, t, o
udiva, u, d, i, v, a
udivi, u, d, i, v, i
udivo, u, d, i, v, o
uggia, u, g, g, i, a
ugola, u, g, o, l, a
ugole, u, g, o, l, e
ukase, u, k, a, s, e
ulani, u, l, a, n, i
ulano, u, l, a, n, o
ulite, u, l, i, t, e
uliti, u, l, i, t, i
uliva, u, l, i, v, a
ulive, u, l, i, v, e
ulivi, u, l, i, v, i
ulivo, u, l, i, v, o
ultra, u, l, t, r, a
ulula, u, l, u, l, a
ululi, u, l, u, l, i
ululo, u, l, u, l, o
umana, u, m, a, n, a
umane, u, m, a, n, e
umani, u, m, a, n, i
umano, u, m, a, n, o
umato, u, m, a, t, o
umbra, u, m, b, r, a
umbre, u, m, b, r, e
umbri, u, m, b, r, i
umbro, u, m, b, r, o
umica, u, m, i, c, a
umici, u, m, i, c, i
umico, u, m, i, c, o
umida, u, m, i, d, a
umide, u, m, i, d, e
umidi, u, m, i, d, i
umido, u, m, i, d, o
umile, u, m, i, l, e
umili, u, m, i, l, i
umore, u, m, o, r, e
umori, u, m, o, r, i
under, u, n, d, e, r
unica, u, n, i, c, a
unici, u, n, i, c, i
unico, u, n, i, c, o
union, u, n, i, o, n
unire, u, n, i, r, e
unita, u, n, i, t, a
unite, u, n, i, t, e
uniti, u, n, i, t, i
unito, u, n, i, t, o
univa, u, n, i, v, a
univi, u, n, i, v, i
univo, u, n, i, v, o
upupa, u, p, u, p, a
upupe, u, p, u, p, e
uralo, u, r, a, l, o
urani, u, r, a, n, i
urano, u, r, a, n, o
urato, u, r, a, t, o
urica, u, r, i, c, a
urici, u, r, i, c, i
urico, u, r, i, c, o
urina, u, r, i, n, a
urine, u, r, i, n, e
urlai, u, r, l, a, i
urlii, u, r, l, i, i
urlio, u, r, l, i, o
usano, u, s, a, n, o
usare, u, s, a, r, e
usata, u, s, a, t, a
usate, u, s, a, t, e
usati, u, s, a, t, i
usato, u, s, a, t, o
usava, u, s, a, v, a
usavi, u, s, a, v, i
usavo, u, s, a, v, o
uscii, u, s, c, i, i
uscio, u, s, c, i, o
uscir, u, s, c, i, r
usera, u, s, e, r, a
usero, u, s, e, r, o
usino, u, s, i, n, o
usura, u, s, u, r, a
usure, u, s, u, r, e
uteri, u, t, e, r, i
utero, u, t, e, r, o
utica, u, t, i, c, a
utile, u, t, i, l, e
utili, u, t, i, l, i
uvala, u, v, a, l, a
uvula, u, v, u, l, a
uvule, u, v, u, l, e
uxori, u, x, o, r, i
vacca, v, a, c, c, a
vacua, v, a, c, u, a
vacue, v, a, c, u, e
vacui, v, a, c, u, i
vacuo, v, a, c, u, o
vaduz, v, a, d, u, z
vafer, v, a, f, e, r
vaffa, v, a, f, f, a
vaghe, v, a, g, h, e
vaghi, v, a, g, h, i
vagli, v, a, g, l, i
vague, v, a, g, u, e
valga, v, a, l, g, a
valgo, v, a, l, g, o
valle, v, a, l, l, e
valli, v, a, l, l, i
vallo, v, a, l, l, o
valse, v, a, l, s, e
valva, v, a, l, v, a
valve, v, a, l, v, e
vampa, v, a, m, p, a
vampe, v, a, m, p, e
vampi, v, a, m, p, i
vampo, v, a, m, p, o
vamps, v, a, m, p, s
vanga, v, a, n, g, a
vango, v, a, n, g, o
vanne, v, a, n, n, e
vanno, v, a, n, n, o
vanta, v, a, n, t, a
vanti, v, a, n, t, i
vanto, v, a, n, t, o
varca, v, a, r, c, a
varco, v, a, r, c, o
varea, v, a, r, e, a
varee, v, a, r, e, e
varia, v, a, r, i, a
varie, v, a, r, i, e
vario, v, a, r, i, o
varra, v, a, r, r, a
varva, v, a, r, v, a
varve, v, a, r, v, e
vasai, v, a, s, a, i
vasca, v, a, s, c, a
vasco, v, a, s, c, o
vasta, v, a, s, t, a
vaste, v, a, s, t, e
vasti, v, a, s, t, i
vasto, v, a, s, t, o
vatti, v, a, t, t, i
vauda, v, a, u, d, a
vecce, v, e, c, c, e
vecia, v, e, c, i, a
vecio, v, e, c, i, o
veder, v, e, d, e, r
vedra, v, e, d, r, a
vedro, v, e, d, r, o
vegli, v, e, g, l, i
velai, v, e, l, a, i
velde, v, e, l, d, e
velia, v, e, l, i, a
velie, v, e, l, i, e
velli, v, e, l, l, i
vello, v, e, l, l, o
velma, v, e, l, m, a
velme, v, e, l, m, e
venda, v, e, n, d, a
vende, v, e, n, d, e
vendi, v, e, n, d, i
vendo, v, e, n, d, o
venga, v, e, n, g, a
vengo, v, e, n, g, o
venia, v, e, n, i, a
venie, v, e, n, i, e
venir, v, e, n, i, r
venne, v, e, n, n, e
venni, v, e, n, n, i
venti, v, e, n, t, i
vento, v, e, n, t, o
verbi, v, e, r, b, i
verbo, v, e, r, b, o
verde, v, e, r, d, e
verdi, v, e, r, d, i
verga, v, e, r, g, a
vergo, v, e, r, g, o
verla, v, e, r, l, a
verle, v, e, r, l, e
verme, v, e, r, m, e
vermi, v, e, r, m, i
verne, v, e, r, n, e
verra, v, e, r, r, a
verri, v, e, r, r, i
verro, v, e, r, r, o
versa, v, e, r, s, a
verse, v, e, r, s, e
versi, v, e, r, s, i
verso, v, e, r, s, o
verta, v, e, r, t, a
verte, v, e, r, t, e
verve, v, e, r, v, e
verza, v, e, r, z, a
verze, v, e, r, z, e
vesce, v, e, s, c, e
vespa, v, e, s, p, a
vespe, v, e, s, p, e
vessa, v, e, s, s, a
vessi, v, e, s, s, i
vesso, v, e, s, s, o
vesta, v, e, s, t, a
veste, v, e, s, t, e
vesti, v, e, s, t, i
vesto, v, e, s, t, o
vetri, v, e, t, r, i
vetro, v, e, t, r, o
vetta, v, e, t, t, a
vette, v, e, t, t, e
vezzi, v, e, z, z, i
vezzo, v, e, z, z, o
viado, v, i, a, d, o
viale, v, i, a, l, e
viali, v, i, a, l, i
viari, v, i, a, r, i
vibra, v, i, b, r, a
vibri, v, i, b, r, i
vibro, v, i, b, r, o
vichi, v, i, c, h, i
video, v, i, d, e, o
vidor, v, i, d, o, r
viene, v, i, e, n, e
vieni, v, i, e, n, i
vieta, v, i, e, t, a
viete, v, i, e, t, e
vieti, v, i, e, t, i
vieto, v, i, e, t, o
vigna, v, i, g, n, a
vigne, v, i, g, n, e
vigny, v, i, g, n, y
villa, v, i, l, l, a
ville, v, i, l, l, e
villi, v, i, l, l, i
villo, v, i, l, l, o
vilta, v, i, l, t, a
vinai, v, i, n, a, i
vince, v, i, n, c, e
vinci, v, i, n, c, i
vinco, v, i, n, c, o
vinse, v, i, n, s, e
vinsi, v, i, n, s, i
vinta, v, i, n, t, a
vinte, v, i, n, t, e
vinti, v, i, n, t, i
vinto, v, i, n, t, o
viola, v, i, o, l, a
viole, v, i, o, l, e
violi, v, i, o, l, i
violo, v, i, o, l, o
vipla, v, i, p, l, a
viple, v, i, p, l, e
virga, v, i, r, g, a
virtu, v, i, r, t, u
virus, v, i, r, u, s
visco, v, i, s, c, o
visir, v, i, s, i, r
visnu, v, i, s, n, u
vispa, v, i, s, p, a
vispe, v, i, s, p, e
vispi, v, i, s, p, i
vispo, v, i, s, p, o
visse, v, i, s, s, e
vissi, v, i, s, s, i
visso, v, i, s, s, o
vista, v, i, s, t, a
viste, v, i, s, t, e
visti, v, i, s, t, i
visto, v, i, s, t, o
visus, v, i, s, u, s
