curvo, c, u, r, v, o
cuvee, c, u, v, e, e
dacci, d, a, c, c, i
dacia, d, a, c, i, a
dacie, d, a, c, i, e
dadas, d, a, d, a, s
daghe, d, a, g, h, e
dagli, d, a, g, l, i
daini, d, a, i, n, i
daino, d, a, i, n, o
dalia, d, a, l, i, a
dalie, d, a, l, i, e
dalla, d, a, l, l, a
dalle, d, a, l, l, e
dallo, d, a, l, l, o
damma, d, a, m, m, a
dammi, d, a, m, m, i
dance, d, a, n, c, e
danda, d, a, n, d, a
dande, d, a, n, d, e
dando, d, a, n, d, o
dandy, d, a, n, d, y
danna, d, a, n, n, a
danne, d, a, n, n, e
danni, d, a, n, n, i
danno, d, a, n, n, o
dante, d, a, n, t, e
danti, d, a, n, t, i
danza, d, a, n, z, a
danze, d, a, n, z, e
danzi, d, a, n, z, i
danzo, d, a, n, z, o
darai, d, a, r, a, i
darci, d, a, r, c, i
dardi, d, a, r, d, i
dardo, d, a, r, d, o
darei, d, a, r, e, i
dario, d, a, r, i, o
darla, d, a, r, l, a
darle, d, a, r, l, e
darli, d, a, r, l, i
darlo, d, a, r, l, o
darmi, d, a, r, m, i
darne, d, a, r, n, e
darsi, d, a, r, s, i
darti, d, a, r, t, i
darvi, d, a, r, v, i
datai, d, a, t, a, i
datti, d, a, t, t, i
dazio, d, a, z, i, o
debba, d, e, b, b, a
debbi, d, e, b, b, i
debbo, d, e, b, b, o
decoy, d, e, c, o, y
degli, d, e, g, l, i
degna, d, e, g, n, a
degne, d, e, g, n, e
degni, d, e, g, n, i
degno, d, e, g, n, o
deita, d, e, i, t, a
della, d, e, l, l, a
delle, d, e, l, l, e
dello, d, e, l, l, o
delta, d, e, l, t, a
demmo, d, e, m, m, o
denim, d, e, n, i, m
densa, d, e, n, s, a
dense, d, e, n, s, e
densi, d, e, n, s, i
denso, d, e, n, s, o
dente, d, e, n, t, e
denti, d, e, n, t, i
derby, d, e, r, b, y
derma, d, e, r, m, a
dermi, d, e, r, m, i
dermo, d, e, r, m, o
desco, d, e, s, c, o
desii, d, e, s, i, i
desio, d, e, s, i, o
desmo, d, e, s, m, o
dessa, d, e, s, s, a
desse, d, e, s, s, e
dessi, d, e, s, s, i
desso, d, e, s, s, o
desta, d, e, s, t, a
deste, d, e, s, t, e
desti, d, e, s, t, i
desto, d, e, s, t, o
detta, d, e, t, t, a
dette, d, e, t, t, e
detti, d, e, t, t, i
detto, d, e, t, t, o
devii, d, e, v, i, i
diade, d, i, a, d, e
diamo, d, i, a, m, o
diana, d, i, a, n, a
diane, d, i, a, n, e
diano, d, i, a, n, o
diari, d, i, a, r, i
diate, d, i, a, t, e
dicci, d, i, c, c, i
dicco, d, i, c, c, o
dichi, d, i, c, h, i
dicon, d, i, c, o, n
dieci, d, i, e, c, i
diede, d, i, e, d, e
diedi, d, i, e, d, i
dieta, d, i, e, t, a
diete, d, i, e, t, e
dighe, d, i, g, h, e
digli, d, i, g, l, i
dilla, d, i, l, l, a
dille, d, i, l, l, e
dilli, d, i, l, l, i
dillo, d, i, l, l, o
dilui, d, i, l, u, i
dimmi, d, i, m, m, i
dinne, d, i, n, n, e
diodi, d, i, o, d, i
diodo, d, i, o, d, o
dipoi, d, i, p, o, i
dirai, d, i, r, a, i
dirci, d, i, r, c, i
direi, d, i, r, e, i
dirla, d, i, r, l, a
dirle, d, i, r, l, e
dirlo, d, i, r, l, o
dirmi, d, i, r, m, i
dirne, d, i, r, n, e
dirsi, d, i, r, s, i
dirti, d, i, r, t, i
dirvi, d, i, r, v, i
disco, d, i, s, c, o
disfa, d, i, s, f, a
disii, d, i, s, i, i
disio, d, i, s, i, o
disks, d, i, s, k, s
disse, d, i, s, s, e
dissi, d, i, s, s, i
dista, d, i, s, t, a
disti, d, i, s, t, i
disto, d, i, s, t, o
ditta, d, i, t, t, a
ditte, d, i, t, t, e
dobla, d, o, b, l, a
doble, d, o, b, l, e
docce, d, o, c, c, e
docks, d, o, c, k, s
doghe, d, o, g, h, e
dogli, d, o, g, l, i
dogma, d, o, g, m, a
dogmi, d, o, g, m, i
dolby, d, o, l, b, y
dolce, d, o, l, c, e
dolci, d, o, l, c, i
dolco, d, o, l, c, o
dolgo, d, o, l, g, o
dolio, d, o, l, i, o
dolly, d, o, l, l, y
dolse, d, o, l, s, e
dolsi, d, o, l, s, i
domai, d, o, m, a, i
domma, d, o, m, m, a
dommi, d, o, m, m, i
donai, d, o, n, a, i
donde, d, o, n, d, e
donna, d, o, n, n, a
donne, d, o, n, n, e
donni, d, o, n, n, i
donno, d, o, n, n, o
doppi, d, o, p, p, i
doree, d, o, r, e, e
dorma, d, o, r, m, a
dorme, d, o, r, m, e
dormi, d, o, r, m, i
dormo, d, o, r, m, o
dorra, d, o, r, r, a
dorro, d, o, r, r, o
dorsi, d, o, r, s, i
dorso, d, o, r, s, o
dosai, d, o, s, a, i
dossi, d, o, s, s, i
dosso, d, o, s, s, o
dotai, d, o, t, a, i
dotta, d, o, t, t, a
dotte, d, o, t, t, e
dotti, d, o, t, t, i
dotto, d, o, t, t, o
dovei, d, o, v, e, i
dover, d, o, v, e, r
dovra, d, o, v, r, a
dovro, d, o, v, r, o
draga, d, r, a, g, a
drago, d, r, a, g, o
drang, d, r, a, n, g
draps, d, r, a, p, s
drink, d, r, i, n, k
drive, d, r, i, v, e
droga, d, r, o, g, a
drops, d, r, o, p, s
druda, d, r, u, d, a
drude, d, r, u, d, e
drudi, d, r, u, d, i
drudo, d, r, u, d, o
drupa, d, r, u, p, a
drupe, d, r, u, p, e
drusa, d, r, u, s, a
druse, d, r, u, s, e
drusi, d, r, u, s, i
druso, d, r, u, s, o
duale, d, u, a, l, e
duali, d, u, a, l, i
dubat, d, u, b, a, t
dubbi, d, u, b, b, i
duchi, d, u, c, h, i
dulia, d, u, l, i, a
dulie, d, u, l, i, e
duole, d, u, o, l, e
duoli, d, u, o, l, i
duolo, d, u, o, l, o
duomi, d, u, o, m, i
duomo, d, u, o, m, o
durai, d, u, r, a, i
durra, d, u, r, r, a
durre, d, u, r, r, e
duvet, d, u, v, e, t
ebani, e, b, a, n, i
ebano, e, b, a, n, o
ebbra, e, b, b, r, a
ebbre, e, b, b, r, e
ebbri, e, b, b, r, i
ebbro, e, b, b, r, o
ebete, e, b, e, t, e
ebeti, e, b, e, t, i
ebrea, e, b, r, e, a
ebree, e, b, r, e, e
ebrei, e, b, r, e, i
ebreo, e, b, r, e, o
ecciu, e, c, c, i, u
ecuba, e, c, u, b, a
edace, e, d, a, c, e
edaci, e, d, a, c, i
edema, e, d, e, m, a
edemi, e, d, e, m, i
edera, e, d, e, r, a
edere, e, d, e, r, e
edile, e, d, i, l, e
edili, e, d, i, l, i
edipo, e, d, i, p, o
edita, e, d, i, t, a
edite, e, d, i, t, e
editi, e, d, i, t, i
edito, e, d, i, t, o
educa, e, d, u, c, a
educo, e, d, u, c, o
edule, e, d, u, l, e
eduli, e, d, u, l, i
efebi, e, f, e, b, i
efebo, e, f, e, b, o
efori, e, f, o, r, i
eforo, e, f, o, r, o
egida, e, g, i, d, a
egide, e, g, i, d, e
egira, e, g, i, r, a
egire, e, g, i, r, e
egizi, e, g, i, z, i
ehila, e, h, i, l, a
elato, e, l, a, t, o
elena, e, l, e, n, a
eleni, e, l, e, n, i
eleva, e, l, e, v, a
elevi, e, l, e, v, i
elevo, e, l, e, v, o
elgar, e, l, g, a, r
elica, e, l, i, c, a
elisa, e, l, i, s, a
elise, e, l, i, s, e
elisi, e, l, i, s, i
eliso, e, l, i, s, o
elite, e, l, i, t, e
elogi, e, l, o, g, i
elson, e, l, s, o, n
elude, e, l, u, d, e
eludi, e, l, u, d, i
eludo, e, l, u, d, o
elusa, e, l, u, s, a
eluse, e, l, u, s, e
elusi, e, l, u, s, i
eluso, e, l, u, s, o
emana, e, m, a, n, a
emani, e, m, a, n, i
emano, e, m, a, n, o
emato, e, m, a, t, o
emiri, e, m, i, r, i
emiro, e, m, i, r, o
emolo, e, m, o, l, o
empia, e, m, p, i, a
empie, e, m, p, i, e
empio, e, m, p, i, o
emula, e, m, u, l, a
emule, e, m, u, l, e
emuli, e, m, u, l, i
emulo, e, m, u, l, o
enfia, e, n, f, i, a
enfie, e, n, f, i, e
enfio, e, n, f, i, o
enoli, e, n, o, l, i
enolo, e, n, o, l, o
enter, e, n, t, e, r
entra, e, n, t, r, a
entre, e, n, t, r, e
entri, e, n, t, r, i
entro, e, n, t, r, o
eolio, e, o, l, i, o
epato, e, p, a, t, o
epica, e, p, i, c, a
epici, e, p, i, c, i
epico, e, p, i, c, o
epoca, e, p, o, c, a
epodi, e, p, o, d, i
epodo, e, p, o, d, o
eppur, e, p, p, u, r
eprom, e, p, r, o, m
epura, e, p, u, r, a
epuri, e, p, u, r, i
epuro, e, p, u, r, o
erano, e, r, a, n, o
erari, e, r, a, r, i
eraso, e, r, a, s, o
erbai, e, r, b, a, i
erbio, e, r, b, i, o
erebi, e, r, e, b, i
erebo, e, r, e, b, o
erede, e, r, e, d, e
eredi, e, r, e, d, i
eremi, e, r, e, m, i
eremo, e, r, e, m, o
erica, e, r, i, c, a
erice, e, r, i, c, e
erige, e, r, i, g, e
erigi, e, r, i, g, i
erigo, e, r, i, g, o
ernia, e, r, n, i, a
ernie, e, r, n, i, e
eroga, e, r, o, g, a
erogo, e, r, o, g, o
erosa, e, r, o, s, a
erose, e, r, o, s, e
erosi, e, r, o, s, i
eroso, e, r, o, s, o
eroto, e, r, o, t, o
errai, e, r, r, a, i
esala, e, s, a, l, a
esalo, e, s, a, l, o
esame, e, s, a, m, e
esami, e, s, a, m, i
esani, e, s, a, n, i
esano, e, s, a, n, o
esche, e, s, c, h, e
esige, e, s, i, g, e
esigi, e, s, i, g, i
esile, e, s, i, l, e
esili, e, s, i, l, i
esime, e, s, i, m, e
esimi, e, s, i, m, i
esimo, e, s, i, m, o
esipo, e, s, i, p, o
esita, e, s, i, t, a
esiti, e, s, i, t, i
esito, e, s, i, t, o
esodi, e, s, o, d, i
esodo, e, s, o, d, o
esopo, e, s, o, p, o
esosa, e, s, o, s, a
esose, e, s, o, s, e
esosi, e, s, o, s, i
esoso, e, s, o, s, o
espia, e, s, p, i, a
espii, e, s, p, i, i
espio, e, s, p, i, o
essai, e, s, s, a, i
esser, e, s, s, e, r
estra, e, s, t, r, a
estri, e, s, t, r, i
estro, e, s, t, r, o
esula, e, s, u, l, a
esule, e, s, u, l, e
esuli, e, s, u, l, i
etani, e, t, a, n, i
etano, e, t, a, n, o
etera, e, t, e, r, a
etere, e, t, e, r, e
eteri, e, t, e, r, i
etero, e, t, e, r, o
etesi, e, t, e, s, i
ethos, e, t, h, o, s
etica, e, t, i, c, a
etici, e, t, i, c, i
etico, e, t, i, c, o
etile, e, t, i, l, e
etili, e, t, i, l, i
etimi, e, t, i, m, i
etimo, e, t, i, m, o
etnea, e, t, n, e, a
etnee, e, t, n, e, e
etnei, e, t, n, e, i
etneo, e, t, n, e, o
etnia, e, t, n, i, a
etnie, e, t, n, i, e
evade, e, v, a, d, e
evadi, e, v, a, d, i
evado, e, v, a, d, o
evasa, e, v, a, s, a
evase, e, v, a, s, e
evasi, e, v, a, s, i
evaso, e, v, a, s, o
evita, e, v, i, t, a
eviti, e, v, i, t, i
evito, e, v, i, t, o
evoca, e, v, o, c, a
evoco, e, v, o, c, o
extra, e, x, t, r, a
faber, f, a, b, e, r
fabio, f, a, b, i, o
facce, f, a, c, c, e
facci, f, a, c, c, i
facie, f, a, c, i, e
facto, f, a, c, t, o
fados, f, a, d, o, s
faggi, f, a, g, g, i
fagli, f, a, g, l, i
faida, f, a, i, d, a
faide, f, a, i, d, e
faina, f, a, i, n, a
faine, f, a, i, n, e
faire, f, a, i, r, e
falba, f, a, l, b, a
falbe, f, a, l, b, e
falbi, f, a, l, b, i
falbo, f, a, l, b, o
falca, f, a, l, c, a
falce, f, a, l, c, e
falci, f, a, l, c, i
falco, f, a, l, c, o
falda, f, a, l, d, a
falde, f, a, l, d, e
falla, f, a, l, l, a
falle, f, a, l, l, e
falli, f, a, l, l, i
fallo, f, a, l, l, o
falsa, f, a, l, s, a
false, f, a, l, s, e
falsi, f, a, l, s, i
falso, f, a, l, s, o
fammi, f, a, m, m, i
fanee, f, a, n, e, e
fanes, f, a, n, e, s
fanga, f, a, n, g, a
fango, f, a, n, g, o
fanne, f, a, n, n, e
fanno, f, a, n, n, o
fanta, f, a, n, t, a
fante, f, a, n, t, e
fanti, f, a, n, t, i
farad, f, a, r, a, d
farai, f, a, r, a, i
farce, f, a, r, c, e
farci, f, a, r, c, i
fardi, f, a, r, d, i
fardo, f, a, r, d, o
farei, f, a, r, e, i
farfa, f, a, r, f, a
fario, f, a, r, i, o
farla, f, a, r, l, a
farle, f, a, r, l, e
farli, f, a, r, l, i
farlo, f, a, r, l, o
farmi, f, a, r, m, i
farne, f, a, r, n, e
farri, f, a, r, r, i
farro, f, a, r, r, o
farsa, f, a, r, s, a
farse, f, a, r, s, e
farsi, f, a, r, s, i
farti, f, a, r, t, i
farvi, f, a, r, v, i
fasce, f, a, s, c, e
fasci, f, a, s, c, i
fasta, f, a, s, t, a
faste, f, a, s, t, e
fasti, f, a, s, t, i
fasto, f, a, s, t, o
fatta, f, a, t, t, a
fatte, f, a, t, t, e
fatti, f, a, t, t, i
fatto, f, a, t, t, o
fatua, f, a, t, u, a
fatue, f, a, t, u, e
fatui, f, a, t, u, i
fatuo, f, a, t, u, o
fauci, f, a, u, c, i
fault, f, a, u, l, t
fauna, f, a, u, n, a
faune, f, a, u, n, e
fauni, f, a, u, n, i
fauno, f, a, u, n, o
faure, f, a, u, r, e
faust, f, a, u, s, t
fauve, f, a, u, v, e
febeo, f, e, b, e, o
fecce, f, e, c, c, e
felce, f, e, l, c, e
felci, f, e, l, c, i
fella, f, e, l, l, a
fello, f, e, l, l, o
felpa, f, e, l, p, a
felpe, f, e, l, p, e
felze, f, e, l, z, e
felzi, f, e, l, z, i
femto, f, e, m, t, o
fende, f, e, n, d, e
fendi, f, e, n, d, i
fendo, f, e, n, d, o
fenix, f, e, n, i, x
feria, f, e, r, i, a
ferie, f, e, r, i, e
ferii, f, e, r, i, i
ferma, f, e, r, m, a
ferme, f, e, r, m, e
fermi, f, e, r, m, i
fermo, f, e, r, m, o
ferri, f, e, r, r, i
ferro, f, e, r, r, o
ferry, f, e, r, r, y
fersa, f, e, r, s, a
ferve, f, e, r, v, e
ferzi, f, e, r, z, i
ferzo, f, e, r, z, o
fessa, f, e, s, s, a
fesse, f, e, s, s, e
fessi, f, e, s, s, i
fesso, f, e, s, s, o
festa, f, e, s, t, a
feste, f, e, s, t, e
fetta, f, e, t, t, a
fette, f, e, t, t, e
feudi, f, e, u, d, i
feudo, f, e, u, d, o
fiaba, f, i, a, b, a
fiabe, f, i, a, b, e
fiala, f, i, a, l, a
fiale, f, i, a, l, e
fiata, f, i, a, t, a
fiate, f, i, a, t, e
fiati, f, i, a, t, i
fiato, f, i, a, t, o
fiber, f, i, b, e, r
fibra, f, i, b, r, a
fibre, f, i, b, r, e
ficca, f, i, c, c, a
ficco, f, i, c, c, o
fiche, f, i, c, h, e
fichi, f, i, c, h, i
fichu, f, i, c, h, u
ficus, f, i, c, u, s
fidai, f, i, d, a, i
fidar, f, i, d, a, r
fidia, f, i, d, i, a
fiele, f, i, e, l, e
fieni, f, i, e, n, i
fieno, f, i, e, n, o
fiera, f, i, e, r, a
fiere, f, i, e, r, e
fieri, f, i, e, r, i
fiero, f, i, e, r, o
fifty, f, i, f, t, y
figge, f, i, g, g, e
figgi, f, i, g, g, i
figgo, f, i, g, g, o
fighe, f, i, g, h, e
figli, f, i, g, l, i
filai, f, i, l, a, i
fillo, f, i, l, l, o
filma, f, i, l, m, a
filmi, f, i, l, m, i
filmo, f, i, l, m, o
filza, f, i, l, z, a
filze, f, i, l, z, e
finca, f, i, n, c, a
finga, f, i, n, g, a
finge, f, i, n, g, e
fingi, f, i, n, g, i
fingo, f, i, n, g, o
finii, f, i, n, i, i
finis, f, i, n, i, s
finse, f, i, n, s, e
finsi, f, i, n, s, i
finta, f, i, n, t, a
finte, f, i, n, t, e
finti, f, i, n, t, i
finto, f, i, n, t, o
fioca, f, i, o, c, a
fioco, f, i, o, c, o
fiore, f, i, o, r, e
fiori, f, i, o, r, i
firma, f, i, r, m, a
firme, f, i, r, m, e
firmi, f, i, r, m, i
firmo, f, i, r, m, o
first, f, i, r, s, t
fisco, f, i, s, c, o
fisio, f, i, s, i, o
fissa, f, i, s, s, a
fisse, f, i, s, s, e
fissi, f, i, s, s, i
fisso, f, i, s, s, o
fitta, f, i, t, t, a
fitte, f, i, t, t, e
fitti, f, i, t, t, i
fitto, f, i, t, t, o
fiume, f, i, u, m, e
fiumi, f, i, u, m, i
fiuta, f, i, u, t, a
fiuti, f, i, u, t, i
fiuto, f, i, u, t, o
flani, f, l, a, n, i
flano, f, l, a, n, o
flans, f, l, a, n, s
flash, f, l, a, s, h
flati, f, l, a, t, i
flato, f, l, a, t, o
flava, f, l, a, v, a
flave, f, l, a, v, e
flavi, f, l, a, v, i
flavo, f, l, a, v, o
flebo, f, l, e, b, o
flint, f, l, i, n, t
flirt, f, l, i, r, t
float, f, l, o, a, t
flock, f, l, o, c, k
flora, f, l, o, r, a
flore, f, l, o, r, e
floue, f, l, o, u, e
flous, f, l, o, u, s
fluff, f, l, u, f, f
fluii, f, l, u, i, i
flute, f, l, u, t, e
flyby, f, l, y, b, y
fobia, f, o, b, i, a
fobie, f, o, b, i, e
foche, f, o, c, h, e
fochi, f, o, c, h, i
focus, f, o, c, u, s
fodro, f, o, d, r, o
foehn, f, o, e, h, n
fogge, f, o, g, g, e
foggi, f, o, g, g, i
foghe, f, o, g, h, e
fogli, f, o, g, l, i
fogna, f, o, g, n, a
fogne, f, o, g, n, e
fogno, f, o, g, n, o
foiba, f, o, i, b, a
foibe, f, o, i, b, e
folio, f, o, l, i, o
folla, f, o, l, l, a
folle, f, o, l, l, e
folli, f, o, l, l, i
folta, f, o, l, t, a
folte, f, o, l, t, e
folti, f, o, l, t, i
folto, f, o, l, t, o
fonce, f, o, n, c, e
fonda, f, o, n, d, a
fonde, f, o, n, d, e
fondi, f, o, n, d, i
fondo, f, o, n, d, o
fondu, f, o, n, d, u
fonia, f, o, n, i, a
fonte, f, o, n, t, e
fonti, f, o, n, t, i
forai, f, o, r, a, i
forca, f, o, r, c, a
force, f, o, r, c, e
forfe, f, o, r, f, e
forge, f, o, r, g, e
forgi, f, o, r, g, i
forli, f, o, r, l, i
forma, f, o, r, m, a
forme, f, o, r, m, e
formi, f, o, r, m, i
formo, f, o, r, m, o
forni, f, o, r, n, i
forno, f, o, r, n, o
forra, f, o, r, r, a
forre, f, o, r, r, e
forse, f, o, r, s, e
forte, f, o, r, t, e
forti, f, o, r, t, i
forum, f, o, r, u, m
forza, f, o, r, z, a
forze, f, o, r, z, e
forzi, f, o, r, z, i
forzo, f, o, r, z, o
fosca, f, o, s, c, a
fosco, f, o, s, c, o
fossa, f, o, s, s, a
fosse, f, o, s, s, e
fossi, f, o, s, s, i
fosso, f, o, s, s, o
foste, f, o, s, t, e
fosti, f, o, s, t, i
fotta, f, o, t, t, a
fotte, f, o, t, t, e
fotti, f, o, t, t, i
fotto, f, o, t, t, o
fovea, f, o, v, e, a
foyer, f, o, y, e, r
fozio, f, o, z, i, o
frale, f, r, a, l, e
frali, f, r, a, l, i
frame, f, r, a, m, e
frana, f, r, a, n, a
frane, f, r, a, n, e
frani, f, r, a, n, i
frano, f, r, a, n, o
frase, f, r, a, s, e
frasi, f, r, a, s, i
frate, f, r, a, t, e
frati, f, r, a, t, i
freak, f, r, e, a, k
frega, f, r, e, g, a
fregi, f, r, e, g, i
frego, f, r, e, g, o
frema, f, r, e, m, a
freme, f, r, e, m, e
fremi, f, r, e, m, i
fremo, f, r, e, m, o
frena, f, r, e, n, a
freni, f, r, e, n, i
freno, f, r, e, n, o
freon, f, r, e, o, n
fresa, f, r, e, s, a
frese, f, r, e, s, e
freud, f, r, e, u, d
frigi, f, r, i, g, i
frigo, f, r, i, g, o
frine, f, r, i, n, e
frise, f, r, i, s, e
friso, f, r, i, s, o
froci, f, r, o, c, i
froda, f, r, o, d, a
frode, f, r, o, d, e
frodi, f, r, o, d, i
frodo, f, r, o, d, o
froge, f, r, o, g, e
front, f, r, o, n, t
fruga, f, r, u, g, a
frugo, f, r, u, g, o
fruit, f, r, u, i, t
ftalo, f, t, a, l, o
fuchi, f, u, c, h, i
fugai, f, u, g, a, i
fugga, f, u, g, g, a
fugge, f, u, g, g, e
fuggi, f, u, g, g, i
fughe, f, u, g, h, e
fughi, f, u, g, h, i
fulva, f, u, l, v, a
fulve, f, u, l, v, e
fulvi, f, u, l, v, i
fulvo, f, u, l, v, o
fumai, f, u, m, a, i
fumee, f, u, m, e, e
fumes, f, u, m, e, s
fummo, f, u, m, m, o
funai, f, u, n, a, i
funga, f, u, n, g, a
funge, f, u, n, g, e
fungo, f, u, n, g, o
funky, f, u, n, k, y
funny, f, u, n, n, y
funse, f, u, n, s, e
funsi, f, u, n, s, i
fuoco, f, u, o, c, o
fuori, f, u, o, r, i
furba, f, u, r, b, a
furbe, f, u, r, b, e
furbi, f, u, r, b, i
furbo, f, u, r, b, o
furia, f, u, r, i, a
furie, f, u, r, i, e
furti, f, u, r, t, i
furto, f, u, r, t, o
fusta, f, u, s, t, a
fuste, f, u, s, t, e
fusti, f, u, s, t, i
fusto, f, u, s, t, o
gabbi, g, a, b, b, i
gabbo, g, a, b, b, o
gabon, g, a, b, o, n
gabri, g, a, b, r, i
gadda, g, a, d, d, a
gaeta, g, a, e, t, a
gaffa, g, a, f, f, a
gaffe, g, a, f, f, e
gaggi, g, a, g, g, i
gaire, g, a, i, r, e
galea, g, a, l, e, a
galee, g, a, l, e, e
galgo, g, a, l, g, o
galla, g, a, l, l, a
galle, g, a, l, l, e
galli, g, a, l, l, i
gallo, g, a, l, l, o
galop, g, a, l, o, p
gamba, g, a, m, b, a
gambe, g, a, m, b, e
gambi, g, a, m, b, i
gambo, g, a, m, b, o
games, g, a, m, e, s
gamia, g, a, m, i, a
gamie, g, a, m, i, e
gamma, g, a, m, m, a
gamme, g, a, m, m, e
gamow, g, a, m, o, w
ganci, g, a, n, c, i
ganda, g, a, n, d, a
ganga, g, a, n, g, a
gange, g, a, n, g, e
gangs, g, a, n, g, s
ganza, g, a, n, z, a
ganze, g, a, n, z, e
ganzi, g, a, n, z, i
ganzo, g, a, n, z, o
garbi, g, a, r, b, i
garbo, g, a, r, b, o
garda, g, a, r, d, a
garni, g, a, r, n, i
garri, g, a, r, r, i
garza, g, a, r, z, a
garze, g, a, r, z, e
garzi, g, a, r, z, i
garzo, g, a, r, z, o
gasco, g, a, s, c, o
gassa, g, a, s, s, a
gasse, g, a, s, s, e
gatta, g, a, t, t, a
gatte, g, a, t, t, e
gatti, g, a, t, t, i
gatto, g, a, t, t, o
gaudi, g, a, u, d, i
gauss, g, a, u, s, s
gazza, g, a, z, z, a
gazze, g, a, z, z, e
gazzo, g, a, z, z, o
gechi, g, e, c, h, i
gelai, g, e, l, a, i
gelli, g, e, l, l, i
gelsa, g, e, l, s, a
gelse, g, e, l, s, e
gelsi, g, e, l, s, i
gelso, g, e, l, s, o
gemei, g, e, m, e, i
gemma, g, e, m, m, a
gemme, g, e, m, m, e
gendo, g, e, n, d, o
genet, g, e, n, e, t
genia, g, e, n, i, a
genie, g, e, n, i, e
genio, g, e, n, i, o
genoa, g, e, n, o, a
gente, g, e, n, t, e
genti, g, e, n, t, i
genus, g, e, n, u, s
geode, g, e, o, d, e
geodi, g, e, o, d, i
geomi, g, e, o, m, i
geova, g, e, o, v, a
gergo, g, e, r, g, o
gerla, g, e, r, l, a
gerle, g, e, r, l, e
gerli, g, e, r, l, i
gerlo, g, e, r, l, o
germa, g, e, r, m, a
germe, g, e, r, m, e
germi, g, e, r, m, i
gessi, g, e, s, s, i
gesso, g, e, s, s, o
gesta, g, e, s, t, a
gesti, g, e, s, t, i
gesto, g, e, s, t, o
getta, g, e, t, t, a
gette, g, e, t, t, e
getti, g, e, t, t, i
getto, g, e, t, t, o
ghana, g, h, a, n, a
ghebi, g, h, e, b, i
ghiri, g, h, i, r, i
ghiro, g, h, i, r, o
ghisa, g, h, i, s, a
ghise, g, h, i, s, e
giace, g, i, a, c, e
giaci, g, i, a, c, i
giaco, g, i, a, c, o
giada, g, i, a, d, a
giade, g, i, a, d, e
giamo, g, i, a, m, o
giano, g, i, a, n, o
giara, g, i, a, r, a
giare, g, i, a, r, e
giava, g, i, a, v, a
gibbi, g, i, b, b, i
gibbo, g, i, b, b, o
gibus, g, i, b, u, s
gighe, g, i, g, h, e
gigli, g, i, g, l, i
gihad, g, i, h, a, d
gilda, g, i, l, d, a
gilde, g, i, l, d, e
gimno, g, i, m, n, o
ginno, g, i, n, n, o
gioca, g, i, o, c, a
gioco, g, i, o, c, o
giogo, g, i, o, g, o
gioia, g, i, o, i, a
gioie, g, i, o, i, e
gioii, g, i, o, i, i
gioir, g, i, o, i, r
giona, g, i, o, n, a
giova, g, i, o, v, a
giove, g, i, o, v, e
giovi, g, i, o, v, i
giovo, g, i, o, v, o
gipso, g, i, p, s, o
girai, g, i, r, a, i
girar, g, i, r, a, r
girei, g, i, r, e, i
girio, g, i, r, i, o
girli, g, i, r, l, i
girlo, g, i, r, l, o
girls, g, i, r, l, s
gisse, g, i, s, s, e
gissi, g, i, s, s, i
gisti, g, i, s, t, i
gitta, g, i, t, t, a
gitti, g, i, t, t, i
gitto, g, i, t, t, o
giuba, g, i, u, b, a
giuda, g, i, u, d, a
giudo, g, i, u, d, o
giuli, g, i, u, l, i
giura, g, i, u, r, a
giure, g, i, u, r, e
giuri, g, i, u, r, i
giuro, g, i, u, r, o
giuso, g, i, u, s, o
givan, g, i, v, a, n
glace, g, l, a, c, e
gladi, g, l, a, d, i
gleba, g, l, e, b, a
glebe, g, l, e, b, e
glena, g, l, e, n, a
glene, g, l, e, n, e
gleni, g, l, e, n, i
glico, g, l, i, c, o
gliel, g, l, i, e, l
glien, g, l, i, e, n
glifi, g, l, i, f, i
glifo, g, l, i, f, o
globe, g, l, o, b, e
globi, g, l, o, b, i
globo, g, l, o, b, o
glomi, g, l, o, m, i
glomo, g, l, o, m, o
gluck, g, l, u, c, k
gluco, g, l, u, c, o
gluma, g, l, u, m, a
glume, g, l, u, m, e
gnato, g, n, a, t, o
gnome, g, n, o, m, e
gnomi, g, n, o, m, i
gnomo, g, n, o, m, o
gnosi, g, n, o, s, i
goals, g, o, a, l, s
gobba, g, o, b, b, a
gobbe, g, o, b, b, e
gobbi, g, o, b, b, i
gobbo, g, o, b, b, o
gocce, g, o, c, c, e
gocci, g, o, c, c, i
godea, g, o, d, e, a
godei, g, o, d, e, i
goder, g, o, d, e, r
godet, g, o, d, e, t
godra, g, o, d, r, a
godro, g, o, d, r, o
goffa, g, o, f, f, a
goffe, g, o, f, f, e
goffi, g, o, f, f, i
goffo, g, o, f, f, o
gogna, g, o, g, n, a
gogne, g, o, g, n, e
gogol, g, o, g, o, l
golem, g, o, l, e, m
golfi, g, o, l, f, i
golfo, g, o, l, f, o
golia, g, o, l, i, a
golpe, g, o, l, p, e
golpi, g, o, l, p, i
gomma, g, o, m, m, a
gomme, g, o, m, m, e
gonfi, g, o, n, f, i
gonio, g, o, n, i, o
gonna, g, o, n, n, a
gonne, g, o, n, n, e
gonza, g, o, n, z, a
gonze, g, o, n, z, e
gonzi, g, o, n, z, i
gonzo, g, o, n, z, o
gorge, g, o, r, g, e
gorgo, g, o, r, g, o
gotha, g, o, t, h, a
gotta, g, o, t, t, a
gotte, g, o, t, t, e
gotti, g, o, t, t, i
gotto, g, o, t, t, o
gozzi, g, o, z, z, i
gozzo, g, o, z, z, o
grada, g, r, a, d, a
gradi, g, r, a, d, i
grado, g, r, a, d, o
grafi, g, r, a, f, i
grafo, g, r, a, f, o
graia, g, r, a, i, a
graie, g, r, a, i, e
grama, g, r, a, m, a
grame, g, r, a, m, e
grami, g, r, a, m, i
gramo, g, r, a, m, o
grana, g, r, a, n, a
grand, g, r, a, n, d
grane, g, r, a, n, e
grani, g, r, a, n, i
grano, g, r, a, n, o
grata, g, r, a, t, a
grate, g, r, a, t, e
grati, g, r, a, t, i
grato, g, r, a, t, o
grava, g, r, a, v, a
grave, g, r, a, v, e
gravi, g, r, a, v, i
gravo, g, r, a, v, o
greca, g, r, e, c, a
greci, g, r, e, c, i
greco, g, r, e, c, o
green, g, r, e, e, n
gremi, g, r, e, m, i
greti, g, r, e, t, i
greto, g, r, e, t, o
greve, g, r, e, v, e
grevi, g, r, e, v, i
grida, g, r, i, d, a
gride, g, r, i, d, e
gridi, g, r, i, d, i
grido, g, r, i, d, o
grifi, g, r, i, f, i
grifo, g, r, i, f, o
grige, g, r, i, g, e
grigi, g, r, i, g, i
grill, g, r, i, l, l
grisu, g, r, i, s, u
grogs, g, r, o, g, s
groma, g, r, o, m, a
groom, g, r, o, o, m
growl, g, r, o, w, l
gruma, g, r, u, m, a
grume, g, r, u, m, e
grumi, g, r, u, m, i
grumo, g, r, u, m, o
guaco, g, u, a, c, o
guada, g, u, a, d, a
guade, g, u, a, d, e
guadi, g, u, a, d, i
guado, g, u, a, d, o
guaio, g, u, a, i, o
guani, g, u, a, n, i
guano, g, u, a, n, o
guari, g, u, a, r, i
guata, g, u, a, t, a
guati, g, u, a, t, i
guato, g, u, a, t, o
guest, g, u, e, s, t
gugol, g, u, g, o, l
guida, g, u, i, d, a
guide, g, u, i, d, e
guidi, g, u, i, d, i
guido, g, u, i, d, o
guisa, g, u, i, s, a
guise, g, u, i, s, e
gulag, g, u, l, a, g
gully, g, u, l, l, y
gusci, g, u, s, c, i
gusla, g, u, s, l, a
gusta, g, u, s, t, a
gusti, g, u, s, t, i
gusto, g, u, s, t, o
gutta, g, u, t, t, a
gutti, g, u, t, t, i
gutto, g, u, t, t, o
guzla, g, u, z, l, a
hahni, h, a, h, n, i
haifa, h, a, i, f, a
haiti, h, a, i, t, i
halle, h, a, l, l, e
hallo, h, a, l, l, o
halls, h, a, l, l, s
hanno, h, a, n, n, o
hapax, h, a, p, a, x
happy, h, a, p, p, y
harem, h, a, r, e, m
haute, h, a, u, t, e
haydn, h, a, y, d, n
heavy, h, e, a, v, y
hegel, h, e, g, e, l
heine, h, e, i, n, e
henna, h, e, n, n, a
henne, h, e, n, n, e
henry, h, e, n, r, y
hertz, h, e, r, t, z
hesse, h, e, s, s, e
hevea, h, e, v, e, a
hevee, h, e, v, e, e
hindi, h, i, n, d, i
hippy, h, i, p, p, y
hobby, h, o, b, b, y
hotel, h, o, t, e, l
howea, h, o, w, e, a
hully, h, u, l, l, y
human, h, u, m, a, n
humus, h, u, m, u, s
hurra, h, u, r, r, a
husky, h, u, s, k, y
iacea, i, a, c, e, a
iarda, i, a, r, d, a
iarde, i, a, r, d, e
iatro, i, a, t, r, o
ibero, i, b, e, r, o
ibice, i, b, i, c, e
iblee, i, b, l, e, e
iblei, i, b, l, e, i
ibleo, i, b, l, e, o
iboga, i, b, o, g, a
ibsen, i, b, s, e, n
icaro, i, c, a, r, o
icona, i, c, o, n, a
icone, i, c, o, n, e
icono, i, c, o, n, o
icore, i, c, o, r, e
icori, i, c, o, r, i
ictio, i, c, t, i, o
ictus, i, c, t, u, s
iddio, i, d, d, i, o
idola, i, d, o, l, a
idoli, i, d, o, l, i
idolo, i, d, o, l, o
idria, i, d, r, i, a
iella, i, e, l, l, a
ielle, i, e, l, l, e
igloo, i, g, l, o, o
ignea, i, g, n, e, a
ignee, i, g, n, e, e
ignei, i, g, n, e, i
igneo, i, g, n, e, o
ilare, i, l, a, r, e
ilari, i, l, a, r, i
illis, i, l, l, i, s
ilota, i, l, o, t, a
ilote, i, l, o, t, e
iloti, i, l, o, t, i
image, i, m, a, g, e
imago, i, m, a, g, o
imani, i, m, a, n, i
imano, i, m, a, n, o
imati, i, m, a, t, i
imene, i, m, e, n, e
imeni, i, m, e, n, i
imeno, i, m, e, n, o
imita, i, m, i, t, a
imiti, i, m, i, t, i
imito, i, m, i, t, o
imola, i, m, o, l, a
inaco, i, n, a, c, o
inala, i, n, a, l, a
inali, i, n, a, l, i
inalo, i, n, a, l, o
inane, i, n, a, n, e
inani, i, n, a, n, i
india, i, n, d, i, a
indie, i, n, d, i, e
indio, i, n, d, i, o
infin, i, n, f, i, n
infra, i, n, f, r, a
ingiu, i, n, g, i, u
ingoi, i, n, g, o, i
inizi, i, n, i, z, i
inlei, i, n, l, e, i
inlui, i, n, l, u, i
inmii, i, n, m, i, i
inope, i, n, o, p, e
inopi, i, n, o, p, i
input, i, n, p, u, t
insci, i, n, s, c, i
insin, i, n, s, i, n
inter, i, n, t, e, r
intra, i, n, t, r, a
intro, i, n, t, r, o
intui, i, n, t, u, i
invan, i, n, v, a, n
invar, i, n, v, a, r
inver, i, n, v, e, r
invia, i, n, v, i, a
invii, i, n, v, i, i
invio, i, n, v, i, o
iodio, i, o, d, i, o
ioide, i, o, i, d, e
ioidi, i, o, i, d, i
iolla, i, o, l, l, a
ionio, i, o, n, i, o
ipate, i, p, a, t, e
irata, i, r, a, t, a
irate, i, r, a, t, e
irati, i, r, a, t, i
irato, i, r, a, t, o
ireos, i, r, e, o, s
irica, i, r, i, c, a
irico, i, r, i, c, o
iride, i, r, i, d, e
