iridi, i, r, i, d, i
irish, i, r, i, s, h
irite, i, r, i, t, e
iriti, i, r, i, t, i
irosa, i, r, o, s, a
irose, i, r, o, s, e
irosi, i, r, o, s, i
iroso, i, r, o, s, o
isaia, i, s, a, i, a
ischi, i, s, c, h, i
iside, i, s, i, d, e
islam, i, s, l, a, m
isola, i, s, o, l, a
isole, i, s, o, l, e
isoli, i, s, o, l, i
isolo, i, s, o, l, o
issea, i, s, s, e, a
issee, i, s, s, e, e
issei, i, s, s, e, i
isseo, i, s, s, e, o
istmi, i, s, t, m, i
istmo, i, s, t, m, o
itaca, i, t, a, c, a
itaci, i, t, a, c, i
itaco, i, t, a, c, o
itala, i, t, a, l, a
itale, i, t, a, l, e
itali, i, t, a, l, i
italo, i, t, a, l, o
italy, i, t, a, l, y
itera, i, t, e, r, a
itere, i, t, e, r, e
ittio, i, t, t, i, o
ittri, i, t, t, r, i
iucca, i, u, c, c, a
iurta, i, u, r, t, a
ivata, i, v, a, t, a
ivate, i, v, a, t, e
ivati, i, v, a, t, i
ivato, i, v, a, t, o
ivrea, i, v, r, e, a
jabot, j, a, b, o, t
jacks, j, a, c, k, s
jahve, j, a, h, v, e
jaleo, j, a, l, e, o
james, j, a, m, e, s
jeans, j, e, a, n, s
jeeps, j, e, e, p, s
jenni, j, e, n, n, i
jihad, j, i, h, a, d
jodel, j, o, d, e, l
joint, j, o, i, n, t
jolly, j, o, l, l, y
joule, j, o, u, l, e
joyce, j, o, y, c, e
jumbo, j, u, m, b, o
jupon, j, u, p, o, n
kabul, k, a, b, u, l
kafka, k, a, f, k, a
kajal, k, a, j, a, l
kaone, k, a, o, n, e
kaoni, k, a, o, n, i
kapok, k, a, p, o, k
kasak, k, a, s, a, k
kauri, k, a, u, r, i
kayak, k, a, y, a, k
kazan, k, a, z, a, n
keats, k, e, a, t, s
kefir, k, e, f, i, r
kendo, k, e, n, d, o
kenya, k, e, n, y, a
kepis, k, e, p, i, s
ketch, k, e, t, c, h
khmer, k, h, m, e, r
kilts, k, i, l, t, s
klein, k, l, e, i, n
koala, k, o, a, l, a
kodak, k, o, d, a, k
koine, k, o, i, n, e
kraal, k, r, a, a, l
krebs, k, r, e, b, s
krill, k, r, i, l, l
kriss, k, r, i, s, s
krupp, k, r, u, p, p
kulak, k, u, l, a, k
kuroi, k, u, r, o, i
kuros, k, u, r, o, s
kylix, k, y, l, i, x
kyoto, k, y, o, t, o
kyrie, k, y, r, i, e
laban, l, a, b, a, n
label, l, a, b, e, l
labia, l, a, b, i, a
labor, l, a, b, o, r
lacca, l, a, c, c, a
lacce, l, a, c, c, e
lacci, l, a, c, c, i
ladar, l, a, d, a, r
ladra, l, a, d, r, a
ladre, l, a, d, r, e
ladri, l, a, d, r, i
ladro, l, a, d, r, o
lager, l, a, g, e, r
laghi, l, a, g, h, i
lagna, l, a, g, n, a
lagne, l, a, g, n, e
lagni, l, a, g, n, i
lagno, l, a, g, n, o
laica, l, a, i, c, a
laici, l, a, i, c, i
laico, l, a, i, c, o
laida, l, a, i, d, a
laide, l, a, i, d, e
laidi, l, a, i, d, i
laido, l, a, i, d, o
lalia, l, a, l, i, a
lambi, l, a, m, b, i
lamia, l, a, m, i, a
lamie, l, a, m, i, e
lamio, l, a, m, i, o
lampa, l, a, m, p, a
lampe, l, a, m, p, e
lampi, l, a, m, p, i
lampo, l, a, m, p, o
lanam, l, a, n, a, m
lanca, l, a, n, c, a
lance, l, a, n, c, e
lanci, l, a, n, c, i
landa, l, a, n, d, a
lande, l, a, n, d, e
landi, l, a, n, d, i
lando, l, a, n, d, o
lange, l, a, n, g, e
lanka, l, a, n, k, a
lanzi, l, a, n, z, i
lanzo, l, a, n, z, o
lapin, l, a, p, i, n
lapis, l, a, p, i, s
lappa, l, a, p, p, a
lappe, l, a, p, p, e
lardi, l, a, r, d, i
lardo, l, a, r, d, o
larga, l, a, r, g, a
largi, l, a, r, g, i
largo, l, a, r, g, o
larva, l, a, r, v, a
larve, l, a, r, v, e
lasca, l, a, s, c, a
lasci, l, a, s, c, i
lasco, l, a, s, c, o
laser, l, a, s, e, r
lassa, l, a, s, s, a
lasse, l, a, s, s, e
lassi, l, a, s, s, i
lasso, l, a, s, s, o
lassu, l, a, s, s, u
latin, l, a, t, i, n
latra, l, a, t, r, a
latri, l, a, t, r, i
latro, l, a, t, r, o
latta, l, a, t, t, a
latte, l, a, t, t, e
latti, l, a, t, t, i
lauda, l, a, u, d, a
laude, l, a, u, d, e
laudi, l, a, u, d, i
laura, l, a, u, r, a
lauri, l, a, u, r, i
lauro, l, a, u, r, o
lauta, l, a, u, t, a
laute, l, a, u, t, e
lauti, l, a, u, t, i
lauto, l, a, u, t, o
lavai, l, a, v, a, i
lavan, l, a, v, a, n
lavar, l, a, v, a, r
lazio, l, a, z, i, o
lazos, l, a, z, o, s
lazza, l, a, z, z, a
lazze, l, a, z, z, e
lazzi, l, a, z, z, i
lazzo, l, a, z, z, o
leale, l, e, a, l, e
leali, l, e, a, l, i
least, l, e, a, s, t
lecca, l, e, c, c, a
lecce, l, e, c, c, e
lecci, l, e, c, c, i
lecco, l, e, c, c, o
legai, l, e, g, a, i
legar, l, e, g, a, r
legga, l, e, g, g, a
legge, l, e, g, g, e
leggi, l, e, g, g, i
leggo, l, e, g, g, o
leghe, l, e, g, h, e
leghi, l, e, g, h, i
legna, l, e, g, n, a
legne, l, e, g, n, e
legni, l, e, g, n, i
legno, l, e, g, n, o
leida, l, e, i, d, a
lembi, l, e, m, b, i
lembo, l, e, m, b, o
lemma, l, e, m, m, a
lemme, l, e, m, m, e
lemmi, l, e, m, m, i
lemna, l, e, m, n, a
lenci, l, e, n, c, i
leneo, l, e, n, e, o
lenii, l, e, n, i, i
lenin, l, e, n, i, n
lenta, l, e, n, t, a
lente, l, e, n, t, e
lenti, l, e, n, t, i
lento, l, e, n, t, o
lenza, l, e, n, z, a
lenze, l, e, n, z, e
leone, l, e, o, n, e
leoni, l, e, o, n, i
leppo, l, e, p, p, o
lepra, l, e, p, r, a
lepre, l, e, p, r, e
lepri, l, e, p, r, i
lepto, l, e, p, t, o
lerce, l, e, r, c, e
lerci, l, e, r, c, i
lesbi, l, e, s, b, i
lesbo, l, e, s, b, o
lessa, l, e, s, s, a
lesse, l, e, s, s, e
lessi, l, e, s, s, i
lesso, l, e, s, s, o
lesta, l, e, s, t, a
leste, l, e, s, t, e
lesti, l, e, s, t, i
lesto, l, e, s, t, o
letea, l, e, t, e, a
letee, l, e, t, e, e
letei, l, e, t, e, i
leteo, l, e, t, e, o
letta, l, e, t, t, a
lette, l, e, t, t, e
letti, l, e, t, t, i
letto, l, e, t, t, o
leuco, l, e, u, c, o
leudi, l, e, u, d, i
leudo, l, e, u, d, o
leuti, l, e, u, t, i
leuto, l, e, u, t, o
levai, l, e, v, a, i
levan, l, e, v, a, n
levar, l, e, v, a, r
lewis, l, e, w, i, s
lezio, l, e, z, i, o
lezzi, l, e, z, z, i
lezzo, l, e, z, z, o
liana, l, i, a, n, a
liane, l, i, a, n, e
libet, l, i, b, e, t
libia, l, i, b, i, a
libra, l, i, b, r, a
libre, l, i, b, r, e
libri, l, i, b, r, i
libro, l, i, b, r, o
licci, l, i, c, c, i
licea, l, i, c, e, a
licee, l, i, c, e, e
licei, l, i, c, e, i
liceo, l, i, c, e, o
licet, l, i, c, e, t
licia, l, i, c, i, a
licie, l, i, c, i, e
licio, l, i, c, i, o
lidar, l, i, d, a, r
lidia, l, i, d, i, a
lidio, l, i, d, i, o
liegi, l, i, e, g, i
lieta, l, i, e, t, a
liete, l, i, e, t, e
lieti, l, i, e, t, i
lieto, l, i, e, t, o
lieva, l, i, e, v, a
lieve, l, i, e, v, e
lievi, l, i, e, v, i
lifta, l, i, f, t, a
lifto, l, i, f, t, o
lighe, l, i, g, h, e
ligia, l, i, g, i, a
ligie, l, i, g, i, e
ligio, l, i, g, i, o
ligno, l, i, g, n, o
ligre, l, i, g, r, e
ligri, l, i, g, r, i
lilla, l, i, l, l, a
limai, l, i, m, a, i
liman, l, i, m, a, n
limbi, l, i, m, b, i
limbo, l, i, m, b, o
limii, l, i, m, i, i
limio, l, i, m, i, o
limma, l, i, m, m, a
limme, l, i, m, m, e
limni, l, i, m, n, i
limno, l, i, m, n, o
lince, l, i, n, c, e
linci, l, i, n, c, i
linda, l, i, n, d, a
linde, l, i, n, d, e
lindi, l, i, n, d, i
lindo, l, i, n, d, o
linea, l, i, n, e, a
linee, l, i, n, e, e
linfa, l, i, n, f, a
linfe, l, i, n, f, e
linon, l, i, n, o, n
linus, l, i, n, u, s
lione, l, i, o, n, e
lippa, l, i, p, p, a
lippe, l, i, p, p, e
lippi, l, i, p, p, i
lippo, l, i, p, p, o
liqua, l, i, q, u, a
liquo, l, i, q, u, o
lisca, l, i, s, c, a
lisce, l, i, s, c, e
lisci, l, i, s, c, i
lisso, l, i, s, s, o
lista, l, i, s, t, a
liste, l, i, s, t, e
liszt, l, i, s, z, t
litio, l, i, t, i, o
litri, l, i, t, r, i
litro, l, i, t, r, o
litui, l, i, t, u, i
lituo, l, i, t, u, o
liuti, l, i, u, t, i
liuto, l, i, u, t, o
livio, l, i, v, i, o
livre, l, i, v, r, e
lizza, l, i, z, z, a
lizze, l, i, z, z, e
llano, l, l, a, n, o
lloyd, l, l, o, y, d
lobby, l, o, b, b, y
lobia, l, o, b, i, a
locco, l, o, c, c, o
lochi, l, o, c, h, i
locke, l, o, c, k, e
locri, l, o, c, r, i
locus, l, o, c, u, s
lodai, l, o, d, a, i
lodar, l, o, d, a, r
loden, l, o, d, e, n
loess, l, o, e, s, s
loffa, l, o, f, f, a
loffe, l, o, f, f, e
loffi, l, o, f, f, i
logge, l, o, g, g, e
logia, l, o, g, i, a
login, l, o, g, i, n
logli, l, o, g, l, i
logos, l, o, g, o, s
loica, l, o, i, c, a
loici, l, o, i, c, i
loico, l, o, i, c, o
loira, l, o, i, r, a
lolla, l, o, l, l, a
lolle, l, o, l, l, e
lombi, l, o, m, b, i
lombo, l, o, m, b, o
longa, l, o, n, g, a
longo, l, o, n, g, o
lonza, l, o, n, z, a
lonze, l, o, n, z, e
looks, l, o, o, k, s
loppa, l, o, p, p, a
loppe, l, o, p, p, e
loppi, l, o, p, p, i
lorda, l, o, r, d, a
lorde, l, o, r, d, e
lordi, l, o, r, d, i
lordo, l, o, r, d, o
lords, l, o, r, d, s
losca, l, o, s, c, a
losco, l, o, s, c, o
lotta, l, o, t, t, a
lotte, l, o, t, t, e
lotti, l, o, t, t, i
lotto, l, o, t, t, o
lotus, l, o, t, u, s
lover, l, o, v, e, r
lucca, l, u, c, c, a
lucci, l, u, c, c, i
lucco, l, u, c, c, o
luchi, l, u, c, h, i
lucia, l, u, c, i, a
lucio, l, u, c, i, o
lucra, l, u, c, r, a
lucri, l, u, c, r, i
lucro, l, u, c, r, o
ludri, l, u, d, r, i
ludro, l, u, d, r, o
ludus, l, u, d, u, s
lugli, l, u, g, l, i
luigi, l, u, i, g, i
lulla, l, u, l, l, a
lulle, l, u, l, l, e
lulli, l, u, l, l, i
lully, l, u, l, l, y
lumaa, l, u, m, a, a
lumae, l, u, m, a, e
lumai, l, u, m, a, i
lumen, l, u, m, e, n
lunch, l, u, n, c, h
lunda, l, u, n, d, a
lunga, l, u, n, g, a
lungi, l, u, n, g, i
lungo, l, u, n, g, o
luogo, l, u, o, g, o
lupus, l, u, p, u, s
lurca, l, u, r, c, a
lurco, l, u, r, c, o
lusca, l, u, s, c, a
lusco, l, u, s, c, o
lussa, l, u, s, s, a
lussi, l, u, s, s, i
lusso, l, u, s, s, o
lutea, l, u, t, e, a
lutee, l, u, t, e, e
lutei, l, u, t, e, i
luteo, l, u, t, e, o
lutti, l, u, t, t, i
lutto, l, u, t, t, o
lviii, l, v, i, i, i
lxiii, l, x, i, i, i
lxvii, l, x, v, i, i
lxxii, l, x, x, i, i
lxxiv, l, x, x, i, v
lxxix, l, x, x, i, x
lxxvi, l, x, x, v, i
lxxxi, l, x, x, x, i
lxxxv, l, x, x, x, v
macao, m, a, c, a, o
macco, m, a, c, c, o
macho, m, a, c, h, o
macis, m, a, c, i, s
macra, m, a, c, r, a
macre, m, a, c, r, e
macri, m, a, c, r, i
macro, m, a, c, r, o
madia, m, a, d, i, a
madie, m, a, d, i, e
madre, m, a, d, r, e
madri, m, a, d, r, i
mafia, m, a, f, i, a
mafie, m, a, f, i, e
maggi, m, a, g, g, i
maghe, m, a, g, h, e
maghi, m, a, g, h, i
magia, m, a, g, i, a
magie, m, a, g, i, e
magio, m, a, g, i, o
magli, m, a, g, l, i
magma, m, a, g, m, a
magmi, m, a, g, m, i
magna, m, a, g, n, a
magne, m, a, g, n, e
magni, m, a, g, n, i
magno, m, a, g, n, o
magra, m, a, g, r, a
magre, m, a, g, r, e
magri, m, a, g, r, i
magro, m, a, g, r, o
mahdi, m, a, h, d, i
maine, m, a, i, n, e
major, m, a, j, o, r
malga, m, a, l, g, a
malia, m, a, l, i, a
malie, m, a, l, i, e
malle, m, a, l, l, e
malli, m, a, l, l, i
mallo, m, a, l, l, o
malta, m, a, l, t, a
malte, m, a, l, t, e
malti, m, a, l, t, i
malto, m, a, l, t, o
malva, m, a, l, v, a
malve, m, a, l, v, e
maman, m, a, m, a, n
mamba, m, a, m, b, a
mambi, m, a, m, b, i
mambo, m, a, m, b, o
mamma, m, a, m, m, a
mamme, m, a, m, m, e
manca, m, a, n, c, a
mance, m, a, n, c, e
manco, m, a, n, c, o
manda, m, a, n, d, a
mande, m, a, n, d, e
mandi, m, a, n, d, i
mando, m, a, n, d, o
manet, m, a, n, e, t
mangi, m, a, n, g, i
mango, m, a, n, g, o
mania, m, a, n, i, a
manie, m, a, n, i, e
manna, m, a, n, n, a
manne, m, a, n, n, e
mansa, m, a, n, s, a
manse, m, a, n, s, e
mansi, m, a, n, s, i
manso, m, a, n, s, o
manta, m, a, n, t, a
mante, m, a, n, t, e
manti, m, a, n, t, i
manto, m, a, n, t, o
manuk, m, a, n, u, k
manul, m, a, n, u, l
manus, m, a, n, u, s
manza, m, a, n, z, a
manze, m, a, n, z, e
manzi, m, a, n, z, i
manzo, m, a, n, z, o
manzu, m, a, n, z, u
maona, m, a, o, n, a
maone, m, a, o, n, e
maori, m, a, o, r, i
mappa, m, a, p, p, a
mappe, m, a, p, p, e
mappo, m, a, p, p, o
marat, m, a, r, a, t
marca, m, a, r, c, a
marce, m, a, r, c, e
march, m, a, r, c, h
marci, m, a, r, c, i
marco, m, a, r, c, o
marea, m, a, r, e, a
maree, m, a, r, e, e
maria, m, a, r, i, a
marie, m, a, r, i, e
marin, m, a, r, i, n
mario, m, a, r, i, o
maris, m, a, r, i, s
marks, m, a, r, k, s
marmi, m, a, r, m, i
marmo, m, a, r, m, o
marna, m, a, r, n, a
marne, m, a, r, n, e
marra, m, a, r, r, a
marre, m, a, r, r, e
marsa, m, a, r, s, a
marsc, m, a, r, s, c
marse, m, a, r, s, e
marsi, m, a, r, s, i
marso, m, a, r, s, o
marta, m, a, r, t, a
marte, m, a, r, t, e
marti, m, a, r, t, i
marza, m, a, r, z, a
marze, m, a, r, z, e
marzi, m, a, r, z, i
marzo, m, a, r, z, o
masca, m, a, s, c, a
masce, m, a, s, c, e
maser, m, a, s, e, r
massa, m, a, s, s, a
masse, m, a, s, s, e
massi, m, a, s, s, i
masso, m, a, s, s, o
masti, m, a, s, t, i
masto, m, a, s, t, o
masut, m, a, s, u, t
match, m, a, t, c, h
mater, m, a, t, e, r
matre, m, a, t, r, e
matri, m, a, t, r, i
matta, m, a, t, t, a
matte, m, a, t, t, e
matti, m, a, t, t, i
matto, m, a, t, t, o
maura, m, a, u, r, a
maure, m, a, u, r, e
mauri, m, a, u, r, i
mauro, m, a, u, r, o
mauve, m, a, u, v, e
mazut, m, a, z, u, t
mazza, m, a, z, z, a
mazze, m, a, z, z, e
mazzi, m, a, z, z, i
mazzo, m, a, z, z, o
meare, m, e, a, r, e
meati, m, e, a, t, i
meato, m, e, a, t, o
mecca, m, e, c, c, a
meche, m, e, c, h, e
mecum, m, e, c, u, m
medea, m, e, d, e, a
media, m, e, d, i, a
medie, m, e, d, i, e
medio, m, e, d, i, o
medoc, m, e, d, o, c
melan, m, e, l, a, n
melba, m, e, l, b, a
melee, m, e, l, e, e
melfi, m, e, l, f, i
melia, m, e, l, i, a
melma, m, e, l, m, a
melme, m, e, l, m, e
meloe, m, e, l, o, e
meloi, m, e, l, o, i
melos, m, e, l, o, s
melzi, m, e, l, z, i
melzo, m, e, l, z, o
menai, m, e, n, a, i
menar, m, e, n, a, r
mence, m, e, n, c, e
menci, m, e, n, c, i
menda, m, e, n, d, a
mende, m, e, n, d, e
menni, m, e, n, n, i
menno, m, e, n, n, o
mensa, m, e, n, s, a
mense, m, e, n, s, e
menta, m, e, n, t, a
mente, m, e, n, t, e
menti, m, e, n, t, i
mento, m, e, n, t, o
menus, m, e, n, u, s
meoni, m, e, o, n, i
merca, m, e, r, c, a
merce, m, e, r, c, e
merci, m, e, r, c, i
merco, m, e, r, c, o
merda, m, e, r, d, a
merde, m, e, r, d, e
merge, m, e, r, g, e
mergo, m, e, r, g, o
meria, m, e, r, i, a
merie, m, e, r, i, e
merla, m, e, r, l, a
merle, m, e, r, l, e
merli, m, e, r, l, i
merlo, m, e, r, l, o
merse, m, e, r, s, e
merso, m, e, r, s, o
merta, m, e, r, t, a
merti, m, e, r, t, i
merto, m, e, r, t, o
merze, m, e, r, z, e
mesas, m, e, s, a, s
mesca, m, e, s, c, a
mesce, m, e, s, c, e
mesci, m, e, s, c, i
messa, m, e, s, s, a
messe, m, e, s, s, e
messi, m, e, s, s, i
messo, m, e, s, s, o
mesta, m, e, s, t, a
meste, m, e, s, t, e
mesti, m, e, s, t, i
mesto, m, e, s, t, o
meteo, m, e, t, e, o
meter, m, e, t, e, r
metil, m, e, t, i, l
metri, m, e, t, r, i
metro, m, e, t, r, o
metta, m, e, t, t, a
mette, m, e, t, t, e
metti, m, e, t, t, i
metto, m, e, t, t, o
mezza, m, e, z, z, a
mezze, m, e, z, z, e
mezzi, m, e, z, z, i
mezzo, m, e, z, z, o
miasi, m, i, a, s, i
micca, m, i, c, c, a
micce, m, i, c, c, e
micco, m, i, c, c, o
miche, m, i, c, h, e
michi, m, i, c, h, i
micia, m, i, c, i, a
micie, m, i, c, i, e
micio, m, i, c, i, o
micro, m, i, c, r, o
miele, m, i, e, l, e
mieli, m, i, e, l, i
mielo, m, i, e, l, o
mieta, m, i, e, t, a
miete, m, i, e, t, e
mieti, m, i, e, t, i
mieto, m, i, e, t, o
migli, m, i, g, l, i
migma, m, i, g, m, a
migmi, m, i, g, m, i
milan, m, i, l, a, n
miler, m, i, l, e, r
miles, m, i, l, e, s
milia, m, i, l, i, a
milio, m, i, l, i, o
mille, m, i, l, l, e
milli, m, i, l, l, i
milza, m, i, l, z, a
milze, m, i, l, z, e
mimai, m, i, m, a, i
mimmi, m, i, m, m, i
mimmo, m, i, m, m, o
minia, m, i, n, i, a
minii, m, i, n, i, i
minio, m, i, n, i, o
minor, m, i, n, o, r
minus, m, i, n, u, s
mioma, m, i, o, m, a
miomi, m, i, o, m, i
miope, m, i, o, p, e
miopi, m, i, o, p, i
miosi, m, i, o, s, i
mirai, m, i, r, a, i
miran, m, i, r, a, n
mirar, m, i, r, a, r
mirra, m, i, r, r, a
mirre, m, i, r, r, e
mirti, m, i, r, t, i
mirto, m, i, r, t, o
mises, m, i, s, e, s
mista, m, i, s, t, a
miste, m, i, s, t, e
misti, m, i, s, t, i
misto, m, i, s, t, o
mitra, m, i, t, r, a
mitre, m, i, t, r, e
mixer, m, i, x, e, r
mocci, m, o, c, c, i
model, m, o, d, e, l
modem, m, o, d, e, m
modio, m, o, d, i, o
modus, m, o, d, u, s
moffa, m, o, f, f, a
moffe, m, o, f, f, e
moffi, m, o, f, f, i
moffo, m, o, f, f, o
moggi, m, o, g, g, i
mogia, m, o, g, i, a
mogie, m, o, g, i, e
mogio, m, o, g, i, o
mogli, m, o, g, l, i
mogol, m, o, g, o, l
mohur, m, o, h, u, r
moina, m, o, i, n, a
moine, m, o, i, n, e
moire, m, o, i, r, e
molce, m, o, l, c, e
molla, m, o, l, l, a
molle, m, o, l, l, e
molli, m, o, l, l, i
mollo, m, o, l, l, o
moloc, m, o, l, o, c
molse, m, o, l, s, e
molta, m, o, l, t, a
molte, m, o, l, t, e
molti, m, o, l, t, i
molto, m, o, l, t, o
mommo, m, o, m, m, o
monal, m, o, n, a, l
monca, m, o, n, c, a
monco, m, o, n, c, o
monda, m, o, n, d, a
monde, m, o, n, d, e
mondi, m, o, n, d, i
mondo, m, o, n, d, o
monel, m, o, n, e, l
monet, m, o, n, e, t
money, m, o, n, e, y
monna, m, o, n, n, a
monne, m, o, n, n, e
monsu, m, o, n, s, u
monta, m, o, n, t, a
monte, m, o, n, t, e
monti, m, o, n, t, i
monto, m, o, n, t, o
monza, m, o, n, z, a
moore, m, o, o, r, e
moral, m, o, r, a, l
morbi, m, o, r, b, i
morbo, m, o, r, b, o
morda, m, o, r, d, a
morde, m, o, r, d, e
mordi, m, o, r, d, i
mordo, m, o, r, d, o
mores, m, o, r, e, s
morfi, m, o, r, f, i
morfo, m, o, r, f, o
moria, m, o, r, i, a
morie, m, o, r, i, e
morii, m, o, r, i, i
morir, m, o, r, i, r
morra, m, o, r, r, a
morre, m, o, r, r, e
morro, m, o, r, r, o
morsa, m, o, r, s, a
morse, m, o, r, s, e
morsi, m, o, r, s, i
morso, m, o, r, s, o
morta, m, o, r, t, a
morte, m, o, r, t, e
morti, m, o, r, t, i
morto, m, o, r, t, o
morva, m, o, r, v, a
morve, m, o, r, v, e
mosca, m, o, s, c, a
mosce, m, o, s, c, e
mosci, m, o, s, c, i
mosco, m, o, s, c, o
mossa, m, o, s, s, a
mosse, m, o, s, s, e
mossi, m, o, s, s, i
mosso, m, o, s, s, o
mosti, m, o, s, t, i
mosto, m, o, s, t, o
motel, m, o, t, e, l
motiv, m, o, t, i, v
motta, m, o, t, t, a
motte, m, o, t, t, e
motti, m, o, t, t, i
motto, m, o, t, t, o
mouse, m, o, u, s, e
movea, m, o, v, e, a
movie, m, o, v, i, e
movil, m, o, v, i, l
mozza, m, o, z, z, a
mozze, m, o, z, z, e
mozzi, m, o, z, z, i
mozzo, m, o, z, z, o
mucca, m, u, c, c, a
mucci, m, u, c, c, i
mucco, m, u, c, c, o
muchi, m, u, c, h, i
muffa, m, u, f, f, a
muffe, m, u, f, f, e
muffi, m, u, f, f, i
muffo, m, u, f, f, o
mufla, m, u, f, l, a
mufle, m, u, f, l, e
mufti, m, u, f, t, i
muggi, m, u, g, g, i
mughi, m, u, g, h, i
mugic, m, u, g, i, c
mugik, m, u, g, i, k
mugli, m, u, g, l, i
mulso, m, u, l, s, o
multa, m, u, l, t, a
multe, m, u, l, t, e
multi, m, u, l, t, i
multo, m, u, l, t, o
munch, m, u, n, c, h
mundi, m, u, n, d, i
munga, m, u, n, g, a
munge, m, u, n, g, e
mungi, m, u, n, g, i
munii, m, u, n, i, i
munse, m, u, n, s, e
munsi, m, u, n, s, i
munta, m, u, n, t, a
munte, m, u, n, t, e
munti, m, u, n, t, i
munto, m, u, n, t, o
muoia, m, u, o, i, a
muoio, m, u, o, i, o
muone, m, u, o, n, e
muoni, m, u, o, n, i
muore, m, u, o, r, e
muori, m, u, o, r, i
muova, m, u, o, v, a
muove, m, u, o, v, e
muovi, m, u, o, v, i
muovo, m, u, o, v, o
mural, m, u, r, a, l
murge, m, u, r, g, e
murra, m, u, r, r, a
musci, m, u, s, c, i
musco, m, u, s, c, o
musei, m, u, s, e, i
museo, m, u, s, e, o
music, m, u, s, i, c
musme, m, u, s, m, e
mussa, m, u, s, s, a
mussi, m, u, s, s, i
mutai, m, u, t, a, i
mutar, m, u, t, a, r
mutua, m, u, t, u, a
mutue, m, u, t, u, e
mutui, m, u, t, u, i
mutuo, m, u, t, u, o
muzak, m, u, z, a, k
muzio, m, u, z, i, o
nabis, n, a, b, i, s
nadir, n, a, d, i, r
nafta, n, a, f, t, a
nafte, n, a, f, t, e
naibi, n, a, i, b, i
nandu, n, a, n, d, u
nanfa, n, a, n, f, a
nanna, n, a, n, n, a
nanne, n, a, n, n, e
napea, n, a, p, e, a
napee, n, a, p, e, e
nappa, n, a, p, p, a
nappe, n, a, p, p, e
nappi, n, a, p, p, i
nappo, n, a, p, p, o
narco, n, a, r, c, o
nardo, n, a, r, d, o
narra, n, a, r, r, a
narri, n, a, r, r, i
narro, n, a, r, r, o
nasca, n, a, s, c, a
nasce, n, a, s, c, e
nasci, n, a, s, c, i
nasco, n, a, s, c, o
naspi, n, a, s, p, i
naspo, n, a, s, p, o
nassa, n, a, s, s, a
nasse, n, a, s, s, e
natia, n, a, t, i, a
natie, n, a, t, i, e
natii, n, a, t, i, i
natio, n, a, t, i, o
natta, n, a, t, t, a
natte, n, a, t, t, e
nauco, n, a, u, c, o
nauru, n, a, u, r, u
nauta, n, a, u, t, a
nauti, n, a, u, t, i
necce, n, e, c, c, e
necci, n, e, c, c, i
necro, n, e, c, r, o
nefro, n, e, f, r, o
negai, n, e, g, a, i
neghi, n, e, g, h, i
negli, n, e, g, l, i
negra, n, e, g, r, a
negre, n, e, g, r, e
negri, n, e, g, r, i
negro, n, e, g, r, o
negus, n, e, g, u, s
nehru, n, e, h, r, u
nella, n, e, l, l, a
nelle, n, e, l, l, e
nello, n, e, l, l, o
nembi, n, e, m, b, i
nembo, n, e, m, b, o
nemea, n, e, m, e, a
nemee, n, e, m, e, e
nemei, n, e, m, e, i
nemeo, n, e, m, e, o
nenia, n, e, n, i, a
nenie, n, e, n, i, e
nenni, n, e, n, n, i
nepal, n, e, p, a, l
neper, n, e, p, e, r
nerbi, n, e, r, b, i
nerbo, n, e, r, b, o
nervi, n, e, r, v, i
nervo, n, e, r, v, o
nesci, n, e, s, c, i
nessi, n, e, s, s, i
nesso, n, e, s, s, o
nesti, n, e, s, t, i
nesto, n, e, s, t, o
netta, n, e, t, t, a
nette, n, e, t, t, e
netti, n, e, t, t, i
netto, n, e, t, t, o
neuma, n, e, u, m, a
neumi, n, e, u, m, i
neuri, n, e, u, r, i
neuro, n, e, u, r, o
nevai, n, e, v, a, i
nevro, n, e, v, r, o
nibbi, n, i, b, b, i
nicea, n, i, c, e, a
nicol, n, i, c, o, l
nicti, n, i, c, t, i
nicto, n, i, c, t, o
nient, n, i, e, n, t
nievo, n, i, e, v, o
niger, n, i, g, e, r
night, n, i, g, h, t
nihil, n, i, h, i, l
nimbi, n, i, m, b, i
nimbo, n, i, m, b, o
ninfa, n, i, n, f, a
ninfe, n, i, n, f, e
ninja, n, i, n, j, a
ninna, n, i, n, n, a
ninne, n, i, n, n, e
niobe, n, i, o, b, e
niobi, n, i, o, b, i
nisba, n, i, s, b, a
nissa, n, i, s, s, a
niton, n, i, t, o, n
nitra, n, i, t, r, a
nitri, n, i, t, r, i
nitro, n, i, t, r, o
nitti, n, i, t, t, i
nitto, n, i, t, t, o
niuna, n, i, u, n, a
niuno, n, i, u, n, o
nivea, n, i, v, e, a
nivee, n, i, v, e, e
nivei, n, i, v, e, i
niveo, n, i, v, e, o
nizza, n, i, z, z, a
nobel, n, o, b, e, l
nocca, n, o, c, c, a
noema, n, o, e, m, a
noemi, n, o, e, m, i
noesi, n, o, e, s, i
nomea, n, o, m, e, a
nomee, n, o, m, e, e
nonio, n, o, n, i, o
nonna, n, o, n, n, a
nonne, n, o, n, n, e
nonni, n, o, n, n, i
nonno, n, o, n, n, o
noria, n, o, r, i, a
norie, n, o, r, i, e
norma, n, o, r, m, a
norme, n, o, r, m, e
normo, n, o, r, m, o
norte, n, o, r, t, e
notai, n, o, t, a, i
notes, n, o, t, e, s
notte, n, o, t, t, e
notti, n, o, t, t, i
novus, n, o, v, u, s
nozze, n, o, z, z, e
nubia, n, u, b, i, a
nuche, n, u, c, h, e
nulla, n, u, l, l, a
nulle, n, u, l, l, e
nulli, n, u, l, l, i
nullo, n, u, l, l, o
nummi, n, u, m, m, i
nummo, n, u, m, m, o
nunzi, n, u, n, z, i
nuoce, n, u, o, c, e
nuoci, n, u, o, c, i
nuora, n, u, o, r, a
nuore, n, u, o, r, e
nuoro, n, u, o, r, o
nuota, n, u, o, t, a
nuoti, n, u, o, t, i
nuoto, n, u, o, t, o
nuova, n, u, o, v, a
nuove, n, u, o, v, e
nuovi, n, u, o, v, i
nuovo, n, u, o, v, o
nurse, n, u, r, s, e
nutra, n, u, t, r, a
nutre, n, u, t, r, e
nutri, n, u, t, r, i
nutro, n, u, t, r, o
nyala, n, y, a, l, a
nylon, n, y, l, o, n
obeli, o, b, e, l, i
obelo, o, b, e, l, o
obera, o, b, e, r, a
obero, o, b, e, r, o
obesa, o, b, e, s, a
obese, o, b, e, s, e
obesi, o, b, e, s, i
obeso, o, b, e, s, o
obice, o, b, i, c, e
obici, o, b, i, c, i
obiti, o, b, i, t, i
obito, o, b, i, t, o
oblia, o, b, l, i, a
oblii, o, b, l, i, i
oblio, o, b, l, i, o
oboli, o, b, o, l, i
obolo, o, b, o, l, o
occam, o, c, c, a, m
ocche, o, c, c, h, e
occhi, o, c, c, h, i
occio, o, c, c, i, o
ocree, o, c, r, e, e
octal, o, c, t, a, l
oculi, o, c, u, l, i
oculo, o, c, u, l, o
odeon, o, d, e, o, n
odiai, o, d, i, a, i
odino, o, d, i, n, o
odono, o, d, o, n, o
odora, o, d, o, r, a
odore, o, d, o, r, e
odori, o, d, o, r, i
odoro, o, d, o, r, o
oecio, o, e, c, i, o
offra, o, f, f, r, a
offre, o, f, f, r, e
offri, o, f, f, r, i
offro, o, f, f, r, o
ofide, o, f, i, d, e
ofidi, o, f, i, d, i
ofite, o, f, i, t, e
ofiti, o, f, i, t, i
ogiva, o, g, i, v, a
ogive, o, g, i, v, e
ognun, o, g, n, u, n
ohibo, o, h, i, b, o
ohime, o, h, i, m, e
oidee, o, i, d, e, e
oideo, o, i, d, e, o
oidio, o, i, d, i, o
okapi, o, k, a, p, i
olbia, o, l, b, i, a
olchi, o, l, c, h, i
oldie, o, l, d, i, e
oleum, o, l, e, u, m
oligo, o, l, i, g, o
olire, o, l, i, r, e
oliva, o, l, i, v, a
olive, o, l, i, v, e
olivi, o, l, i, v, i
olivo, o, l, i, v, o
olmio, o, l, m, i, o
olona, o, l, o, n, a
olone, o, l, o, n, e
olore, o, l, o, r, e
oltra, o, l, t, r, a
oltre, o, l, t, r, e
omari, o, m, a, r, i
omaro, o, m, a, r, o
omasi, o, m, a, s, i
omaso, o, m, a, s, o
ombra, o, m, b, r, a
ombre, o, m, b, r, e
ombro, o, m, b, r, o
omega, o, m, e, g, a
omeni, o, m, e, n, i
omeri, o, m, e, r, i
omero, o, m, e, r, o
omine, o, m, i, n, e
omini, o, m, i, n, i
omino, o, m, i, n, o
omise, o, m, i, s, e
omisi, o, m, i, s, i
omnes, o, m, n, e, s
omnia, o, m, n, i, a
omore, o, m, o, r, e
omori, o, m, o, r, i
oncia, o, n, c, i, a
onera, o, n, e, r, a
onere, o, n, e, r, e
oneri, o, n, e, r, i
onero, o, n, e, r, o
onest, o, n, e, s, t
onice, o, n, i, c, e
onici, o, n, i, c, i
onico, o, n, i, c, o
onimo, o, n, i, m, o
oniro, o, n, i, r, o
onora, o, n, o, r, a
onore, o, n, o, r, e
onori, o, n, o, r, i
onoro, o, n, o, r, o
opaca, o, p, a, c, a
opaco, o, p, a, c, o
opale, o, p, a, l, e
opali, o, p, a, l, i
opera, o, p, e, r, a
opere, o, p, e, r, e
operi, o, p, e, r, i
opero, o, p, e, r, o
opima, o, p, i, m, a
opime, o, p, i, m, e
opimi, o, p, i, m, i
opimo, o, p, i, m, o
opina, o, p, i, n, a
oppia, o, p, p, i, a
oppio, o, p, p, i, o
oppla, o, p, p, l, a
opsia, o, p, s, i, a
optai, o, p, t, a, i
orafa, o, r, a, f, a
orafe, o, r, a, f, e
orafi, o, r, a, f, i
orafo, o, r, a, f, o
orale, o, r, a, l, e
orali, o, r, a, l, i
orare, o, r, a, r, e
orari, o, r, a, r, i
orata, o, r, a, t, a
orate, o, r, a, t, e
orazi, o, r, a, z, i
orche, o, r, c, h, e
orchi, o, r, c, h, i
orcio, o, r, c, i, o
order, o, r, d, e, r
orfeo, o, r, f, e, o
orgia, o, r, g, i, a
orgie, o, r, g, i, e
oribi, o, r, i, b, i
orina, o, r, i, n, a
orine, o, r, i, n, e
orino, o, r, i, n, o
orlon, o, r, l, o, n
ormai, o, r, m, a, i
ormea, o, r, m, e, a
ornar, o, r, n, a, r
orobi, o, r, o, b, i
orobo, o, r, o, b, o
oropa, o, r, o, p, a
osano, o, s, a, n, o
osare, o, s, a, r, e
osata, o, s, a, t, a
osate, o, s, a, t, e
osato, o, s, a, t, o
osava, o, s, a, v, a
osavi, o, s, a, v, i
osavo, o, s, a, v, o
oscar, o, s, c, a, r
osche, o, s, c, h, e
oschi, o, s, c, h, i
osees, o, s, e, e, s
osera, o, s, e, r, a
osero, o, s, e, r, o
osino, o, s, i, n, o
osman, o, s, m, a, n
osmio, o, s, m, i, o
ossea, o, s, s, e, a
ossee, o, s, s, e, e
ossei, o, s, s, e, i
osseo, o, s, s, e, o
ossia, o, s, s, i, a
osteo, o, s, t, e, o
ostia, o, s, t, i, a
