abaca, a, b, a, c, a
abaco, a, b, a, c, o
abano, a, b, a, n, o
abate, a, b, a, t, e
abati, a, b, a, t, i
abbai, a, b, b, a, i
abbia, a, b, b, i, a
abbui, a, b, b, u, i
abete, a, b, e, t, e
abeti, a, b, e, t, i
abile, a, b, i, l, e
abili, a, b, i, l, i
abita, a, b, i, t, a
abiti, a, b, i, t, i
abito, a, b, i, t, o
aboli, a, b, o, l, i
abusa, a, b, u, s, a
abusi, a, b, u, s, i
abuso, a, b, u, s, o
acaia, a, c, a, i, a
acari, a, c, a, r, i
acaro, a, c, a, r, o
accia, a, c, c, i, a
aceri, a, c, e, r, i
acero, a, c, e, r, o
acesa, a, c, e, s, a
acese, a, c, e, s, e
acesi, a, c, e, s, i
aceso, a, c, e, s, o
aceti, a, c, e, t, i
aceto, a, c, e, t, o
achea, a, c, h, e, a
achee, a, c, h, e, e
achei, a, c, h, e, i
acheo, a, c, h, e, o
acida, a, c, i, d, a
acide, a, c, i, d, e
acidi, a, c, i, d, i
acido, a, c, i, d, o
acini, a, c, i, n, i
acino, a, c, i, n, o
acori, a, c, o, r, i
acoro, a, c, o, r, o
acqua, a, c, q, u, a
acque, a, c, q, u, e
acqui, a, c, q, u, i
acume, a, c, u, m, e
acumi, a, c, u, m, i
acuta, a, c, u, t, a
acute, a, c, u, t, e
acuti, a, c, u, t, i
acuto, a, c, u, t, o
adagi, a, d, a, g, i
adamo, a, d, a, m, o
addii, a, d, d, i, i
addio, a, d, d, i, o
adipe, a, d, i, p, e
adipi, a, d, i, p, i
adira, a, d, i, r, a
adire, a, d, i, r, e
adiri, a, d, i, r, i
adiro, a, d, i, r, o
aditi, a, d, i, t, i
adito, a, d, i, t, o
adone, a, d, o, n, e
adoni, a, d, o, n, i
adora, a, d, o, r, a
adori, a, d, o, r, i
adoro, a, d, o, r, o
adoxa, a, d, o, x, a
adula, a, d, u, l, a
aduli, a, d, u, l, i
adulo, a, d, u, l, o
aduna, a, d, u, n, a
aduni, a, d, u, n, i
aduno, a, d, u, n, o
adusa, a, d, u, s, a
aduse, a, d, u, s, e
adusi, a, d, u, s, i
aduso, a, d, u, s, o
aequo, a, e, q, u, o
aerea, a, e, r, e, a
aeree, a, e, r, e, e
aerei, a, e, r, e, i
aereo, a, e, r, e, o
afeli, a, f, e, l, i
afide, a, f, i, d, e
afidi, a, f, i, d, i
afnio, a, f, n, i, o
afona, a, f, o, n, a
afone, a, f, o, n, e
afoni, a, f, o, n, i
afono, a, f, o, n, o
afosa, a, f, o, s, a
afose, a, f, o, s, e
afosi, a, f, o, s, i
afoso, a, f, o, s, o
after, a, f, t, e, r
agape, a, g, a, p, e
agapi, a, g, a, p, i
agata, a, g, a, t, a
agate, a, g, a, t, e
agave, a, g, a, v, e
agavi, a, g, a, v, i
aggio, a, g, g, i, o
agile, a, g, i, l, e
agili, a, g, i, l, i
agire, a, g, i, r, e
agita, a, g, i, t, a
agiti, a, g, i, t, i
agito, a, g, i, t, o
aglio, a, g, l, i, o
agnus, a, g, n, u, s
agone, a, g, o, n, e
agoni, a, g, o, n, i
agora, a, g, o, r, a
agore, a, g, o, r, e
aguti, a, g, u, t, i
ahime, a, h, i, m, e
aiola, a, i, o, l, a
aiole, a, i, o, l, e
aiuta, a, i, u, t, a
aiuti, a, i, u, t, i
aiuto, a, i, u, t, o
alala, a, l, a, l, a
alani, a, l, a, n, i
alano, a, l, a, n, o
alare, a, l, a, r, e
alari, a, l, a, r, i
alata, a, l, a, t, a
alate, a, l, a, t, e
alati, a, l, a, t, i
alato, a, l, a, t, o
album, a, l, b, u, m
alche, a, l, c, h, e
alcol, a, l, c, o, l
alcun, a, l, c, u, n
alghe, a, l, g, h, e
alias, a, l, i, a, s
alibi, a, l, i, b, i
alice, a, l, i, c, e
alici, a, l, i, c, i
alida, a, l, i, d, a
alide, a, l, i, d, e
alidi, a, l, i, d, i
alido, a, l, i, d, o
alite, a, l, i, t, e
aliti, a, l, i, t, i
alito, a, l, i, t, o
almea, a, l, m, e, a
almee, a, l, m, e, e
alone, a, l, o, n, e
aloni, a, l, o, n, i
alosa, a, l, o, s, a
alose, a, l, o, s, e
altea, a, l, t, e, a
altee, a, l, t, e, e
alter, a, l, t, e, r
altra, a, l, t, r, a
altre, a, l, t, r, e
altri, a, l, t, r, i
altro, a, l, t, r, o
alvei, a, l, v, e, i
alveo, a, l, v, e, o
alzai, a, l, z, a, i
alzar, a, l, z, a, r
amaca, a, m, a, c, a
amano, a, m, a, n, o
amara, a, m, a, r, a
amare, a, m, a, r, e
amari, a, m, a, r, i
amaro, a, m, a, r, o
amaru, a, m, a, r, u
amata, a, m, a, t, a
amate, a, m, a, t, e
amati, a, m, a, t, i
amato, a, m, a, t, o
amava, a, m, a, v, a
amavi, a, m, a, v, i
amavo, a, m, a, v, o
ambio, a, m, b, i, o
ambra, a, m, b, r, a
ambre, a, m, b, r, e
ameba, a, m, e, b, a
amebe, a, m, e, b, e
amena, a, m, e, n, a
amene, a, m, e, n, e
ameni, a, m, e, n, i
ameno, a, m, e, n, o
amera, a, m, e, r, a
amero, a, m, e, r, o
amica, a, m, i, c, a
amici, a, m, i, c, i
amico, a, m, i, c, o
amidi, a, m, i, d, i
amido, a, m, i, d, o
amino, a, m, i, n, o
amnio, a, m, n, i, o
amomi, a, m, o, m, i
amomo, a, m, o, m, o
amore, a, m, o, r, e
amori, a, m, o, r, i
ampex, a, m, p, e, x
ampia, a, m, p, i, a
ampie, a, m, p, i, e
ampio, a, m, p, i, o
ampli, a, m, p, l, i
anale, a, n, a, l, e
anali, a, n, a, l, i
anche, a, n, c, h, e
ancia, a, n, c, i, a
ancor, a, n, c, o, r
andai, a, n, d, a, i
andar, a, n, d, a, r
andra, a, n, d, r, a
andro, a, n, d, r, o
anela, a, n, e, l, a
anele, a, n, e, l, e
aneli, a, n, e, l, i
anelo, a, n, e, l, o
aneti, a, n, e, t, i
aneto, a, n, e, t, o
angla, a, n, g, l, a
angle, a, n, g, l, e
angli, a, n, g, l, i
anglo, a, n, g, l, o
angue, a, n, g, u, e
anice, a, n, i, c, e
anici, a, n, i, c, i
anima, a, n, i, m, a
anime, a, n, i, m, e
animi, a, n, i, m, i
animo, a, n, i, m, o
anjou, a, n, j, o, u
annam, a, n, n, a, m
annoi, a, n, n, o, i
annua, a, n, n, u, a
annue, a, n, n, u, e
annui, a, n, n, u, i
annuo, a, n, n, u, o
anobi, a, n, o, b, i
anodi, a, n, o, d, i
anodo, a, n, o, d, o
anona, a, n, o, n, a
anone, a, n, o, n, e
ansia, a, n, s, i, a
ansie, a, n, s, i, e
anteo, a, n, t, e, o
antri, a, n, t, r, i
antro, a, n, t, r, o
anuri, a, n, u, r, i
anuro, a, n, u, r, o
anzio, a, n, z, i, o
aorta, a, o, r, t, a
aorte, a, o, r, t, e
aosta, a, o, s, t, a
apice, a, p, i, c, e
apici, a, p, i, c, i
apnea, a, p, n, e, a
apnee, a, p, n, e, e
apoda, a, p, o, d, a
apode, a, p, o, d, e
apodi, a, p, o, d, i
apodo, a, p, o, d, o
appai, a, p, p, a, i
appie, a, p, p, i, e
aprii, a, p, r, i, i
aprir, a, p, r, i, r
araba, a, r, a, b, a
arabe, a, r, a, b, e
arabi, a, r, a, b, i
arabo, a, r, a, b, o
arano, a, r, a, n, o
arare, a, r, a, r, e
arata, a, r, a, t, a
arate, a, r, a, t, e
arati, a, r, a, t, i
arato, a, r, a, t, o
arava, a, r, a, v, a
aravi, a, r, a, v, i
aravo, a, r, a, v, o
arche, a, r, c, h, e
archi, a, r, c, h, i
ardea, a, r, d, e, a
ardii, a, r, d, i, i
ardua, a, r, d, u, a
ardue, a, r, d, u, e
ardui, a, r, d, u, i
arduo, a, r, d, u, o
areca, a, r, e, c, a
arena, a, r, e, n, a
arene, a, r, e, n, e
arera, a, r, e, r, a
arero, a, r, e, r, o
arghi, a, r, g, h, i
argon, a, r, g, o, n
argot, a, r, g, o, t
arida, a, r, i, d, a
aride, a, r, i, d, e
aridi, a, r, i, d, i
arido, a, r, i, d, o
arino, a, r, i, n, o
arles, a, r, l, e, s
armai, a, r, m, a, i
arnaz, a, r, n, a, z
arnia, a, r, n, i, a
arnie, a, r, n, i, e
aroma, a, r, o, m, a
aromi, a, r, o, m, i
arpia, a, r, p, i, a
arpie, a, r, p, i, e
arqua, a, r, q, u, a
arrak, a, r, r, a, k
array, a, r, r, a, y
aschi, a, s, c, h, i
ascia, a, s, c, i, a
ascii, a, s, c, i, i
asdic, a, s, d, i, c
asili, a, s, i, l, i
asilo, a, s, i, l, o
asina, a, s, i, n, a
asine, a, s, i, n, e
asini, a, s, i, n, i
asino, a, s, i, n, o
asola, a, s, o, l, a
asole, a, s, o, l, e
aspra, a, s, p, r, a
aspre, a, s, p, r, e
aspri, a, s, p, r, i
aspro, a, s, p, r, o
assai, a, s, s, a, i
aster, a, s, t, e, r
astio, a, s, t, i, o
astri, a, s, t, r, i
astro, a, s, t, r, o
atene, a, t, e, n, e
atomi, a, t, o, m, i
atomo, a, t, o, m, o
atona, a, t, o, n, a
atone, a, t, o, n, e
atoni, a, t, o, n, i
atono, a, t, o, n, o
atout, a, t, o, u, t
atrii, a, t, r, i, i
atrio, a, t, r, i, o
attua, a, t, t, u, a
attui, a, t, t, u, i
attuo, a, t, t, u, o
audio, a, u, d, i, o
auffa, a, u, f, f, a
aulos, a, u, l, o, s
aurea, a, u, r, e, a
auree, a, u, r, e, e
aurei, a, u, r, e, i
aureo, a, u, r, e, o
avana, a, v, a, n, a
avant, a, v, a, n, t
avara, a, v, a, r, a
avare, a, v, a, r, e
avari, a, v, a, r, i
avaro, a, v, a, r, o
avena, a, v, e, n, a
avene, a, v, e, n, e
avere, a, v, e, r, e
averi, a, v, e, r, i
avete, a, v, e, t, e
aveva, a, v, e, v, a
avevi, a, v, e, v, i
avevo, a, v, e, v, o
avida, a, v, i, d, a
avide, a, v, i, d, e
avidi, a, v, i, d, i
avido, a, v, i, d, o
avita, a, v, i, t, a
avite, a, v, i, t, e
aviti, a, v, i, t, i
avito, a, v, i, t, o
avolo, a, v, o, l, o
avori, a, v, o, r, i
avrai, a, v, r, a, i
avran, a, v, r, a, n
avrei, a, v, r, e, i
avuta, a, v, u, t, a
avute, a, v, u, t, e
avuti, a, v, u, t, i
avuto, a, v, u, t, o
avvia, a, v, v, i, a
avvii, a, v, v, i, i
avvio, a, v, v, i, o
azoti, a, z, o, t, i
azoto, a, z, o, t, o
babau, b, a, b, a, u
babbi, b, a, b, b, i
babbo, b, a, b, b, o
bacca, b, a, c, c, a
bacco, b, a, c, c, o
bachi, b, a, c, h, i
bacia, b, a, c, i, a
bacie, b, a, c, i, e
bacio, b, a, c, i, o
bacon, b, a, c, o, n
badai, b, a, d, a, i
badia, b, a, d, i, a
badie, b, a, d, i, e
baffi, b, a, f, f, i
baffo, b, a, f, f, o
bagli, b, a, g, l, i
bagna, b, a, g, n, a
bagni, b, a, g, n, i
bagno, b, a, g, n, o
baita, b, a, i, t, a
baite, b, a, i, t, e
balba, b, a, l, b, a
balbe, b, a, l, b, e
balbi, b, a, l, b, i
balbo, b, a, l, b, o
balda, b, a, l, d, a
balde, b, a, l, d, e
baldi, b, a, l, d, i
baldo, b, a, l, d, o
balia, b, a, l, i, a
balie, b, a, l, i, e
balio, b, a, l, i, o
balla, b, a, l, l, a
balle, b, a, l, l, e
balli, b, a, l, l, i
ballo, b, a, l, l, o
balsa, b, a, l, s, a
balse, b, a, l, s, e
balta, b, a, l, t, a
balte, b, a, l, t, e
balza, b, a, l, z, a
balze, b, a, l, z, e
balzi, b, a, l, z, i
balzo, b, a, l, z, o
bambu, b, a, m, b, u
banca, b, a, n, c, a
banco, b, a, n, c, o
banda, b, a, n, d, a
bande, b, a, n, d, e
bandi, b, a, n, d, i
bando, b, a, n, d, o
bands, b, a, n, d, s
bangi, b, a, n, g, i
banjo, b, a, n, j, o
bantu, b, a, n, t, u
barai, b, a, r, a, i
barba, b, a, r, b, a
barbe, b, a, r, b, e
barbi, b, a, r, b, i
barbo, b, a, r, b, o
barca, b, a, r, c, a
barda, b, a, r, d, a
barde, b, a, r, d, e
bardi, b, a, r, d, i
bardo, b, a, r, d, o
baria, b, a, r, i, a
barie, b, a, r, i, e
bario, b, a, r, i, o
barra, b, a, r, r, a
barre, b, a, r, r, e
basai, b, a, s, a, i
basca, b, a, s, c, a
basco, b, a, s, c, o
bassa, b, a, s, s, a
basse, b, a, s, s, e
bassi, b, a, s, s, i
basso, b, a, s, s, o
basta, b, a, s, t, a
baste, b, a, s, t, e
basti, b, a, s, t, i
basto, b, a, s, t, o
batik, b, a, t, i, k
batta, b, a, t, t, a
batte, b, a, t, t, e
batti, b, a, t, t, i
batto, b, a, t, t, o
baule, b, a, u, l, e
bauli, b, a, u, l, i
bazar, b, a, z, a, r
bazza, b, a, z, z, a
bazze, b, a, z, z, e
beata, b, e, a, t, a
beate, b, e, a, t, e
beati, b, e, a, t, i
beato, b, e, a, t, o
becca, b, e, c, c, a
becco, b, e, c, c, o
beffa, b, e, f, f, a
beffe, b, e, f, f, e
beghe, b, e, g, h, e
begli, b, e, g, l, i
begum, b, e, g, u, m
beige, b, e, i, g, e
belga, b, e, l, g, a
belgi, b, e, l, g, i
bella, b, e, l, l, a
belle, b, e, l, l, e
belli, b, e, l, l, i
bello, b, e, l, l, o
belta, b, e, l, t, a
belva, b, e, l, v, a
belve, b, e, l, v, e
benda, b, e, n, d, a
bende, b, e, n, d, e
bendi, b, e, n, d, i
bendo, b, e, n, d, o
benna, b, e, n, n, a
benne, b, e, n, n, e
benni, b, e, n, n, i
bensi, b, e, n, s, i
beola, b, e, o, l, a
beole, b, e, o, l, e
beona, b, e, o, n, a
beone, b, e, o, n, e
beoni, b, e, o, n, i
beota, b, e, o, t, a
beote, b, e, o, t, e
beoti, b, e, o, t, i
berci, b, e, r, c, i
berlo, b, e, r, l, o
berna, b, e, r, n, a
berra, b, e, r, r, a
berro, b, e, r, r, o
bersi, b, e, r, s, i
berso, b, e, r, s, o
berta, b, e, r, t, a
berte, b, e, r, t, e
betel, b, e, t, e, l
beton, b, e, t, o, n
betta, b, e, t, t, a
bette, b, e, t, t, e
beuta, b, e, u, t, a
beute, b, e, u, t, e
bevve, b, e, v, v, e
bevvi, b, e, v, v, i
bezzi, b, e, z, z, i
bezzo, b, e, z, z, o
biada, b, i, a, d, a
biade, b, i, a, d, e
biavo, b, i, a, v, o
biche, b, i, c, h, e
bidet, b, i, d, e, t
bieca, b, i, e, c, a
bieco, b, i, e, c, o
biffa, b, i, f, f, a
biffe, b, i, f, f, e
bighe, b, i, g, h, e
bigia, b, i, g, i, a
bigie, b, i, g, i, e
bigio, b, i, g, i, o
bigne, b, i, g, n, e
bijou, b, i, j, o, u
bilia, b, i, l, i, a
bilie, b, i, l, i, e
bimba, b, i, m, b, a
bimbe, b, i, m, b, e
bimbi, b, i, m, b, i
bimbo, b, i, m, b, o
binda, b, i, n, d, a
binde, b, i, n, d, e
bingo, b, i, n, g, o
biodi, b, i, o, d, i
biodo, b, i, o, d, o
birba, b, i, r, b, a
birbe, b, i, r, b, e
birbi, b, i, r, b, i
birbo, b, i, r, b, o
birra, b, i, r, r, a
birre, b, i, r, r, e
birri, b, i, r, r, i
birro, b, i, r, r, o
bisca, b, i, s, c, a
bisce, b, i, s, c, e
bissi, b, i, s, s, i
bisso, b, i, s, s, o
bitta, b, i, t, t, a
bitte, b, i, t, t, e
bivio, b, i, v, i, o
bizza, b, i, z, z, a
bizze, b, i, z, z, e
blase, b, l, a, s, e
blesa, b, l, e, s, a
blese, b, l, e, s, e
blesi, b, l, e, s, i
bleso, b, l, e, s, o
blitz, b, l, i, t, z
blues, b, l, u, e, s
bluff, b, l, u, f, f
blusa, b, l, u, s, a
bluse, b, l, u, s, e
boara, b, o, a, r, a
boare, b, o, a, r, e
boari, b, o, a, r, i
boaro, b, o, a, r, o
boati, b, o, a, t, i
boato, b, o, a, t, o
bocca, b, o, c, c, a
bocce, b, o, c, c, e
bocci, b, o, c, c, i
bocia, b, o, c, i, a
boema, b, o, e, m, a
boemo, b, o, e, m, o
boera, b, o, e, r, a
boere, b, o, e, r, e
boeri, b, o, e, r, i
boero, b, o, e, r, o
boghe, b, o, g, h, e
bolge, b, o, l, g, e
bolla, b, o, l, l, a
bolle, b, o, l, l, e
bolli, b, o, l, l, i
bollo, b, o, l, l, o
bolsa, b, o, l, s, a
bolse, b, o, l, s, e
bolsi, b, o, l, s, i
bolso, b, o, l, s, o
bomba, b, o, m, b, a
bombe, b, o, m, b, e
bonne, b, o, n, n, e
bonta, b, o, n, t, a
bonza, b, o, n, z, a
bonze, b, o, n, z, e
bonzi, b, o, n, z, i
bonzo, b, o, n, z, o
books, b, o, o, k, s
booms, b, o, o, m, s
bordi, b, o, r, d, i
bordo, b, o, r, d, o
borea, b, o, r, e, a
borei, b, o, r, e, i
borgo, b, o, r, g, o
boria, b, o, r, i, a
borie, b, o, r, i, e
borra, b, o, r, r, a
borre, b, o, r, r, e
borri, b, o, r, r, i
borro, b, o, r, r, o
borsa, b, o, r, s, a
borse, b, o, r, s, e
bosco, b, o, s, c, o
bossa, b, o, s, s, a
bossi, b, o, s, s, i
bosso, b, o, s, s, o
botri, b, o, t, r, i
botro, b, o, t, r, o
botta, b, o, t, t, a
botte, b, o, t, t, e
botti, b, o, t, t, i
botto, b, o, t, t, o
boxer, b, o, x, e, r
boxes, b, o, x, e, s
bozza, b, o, z, z, a
bozze, b, o, z, z, e
bozzi, b, o, z, z, i
bozzo, b, o, z, z, o
braca, b, r, a, c, a
brace, b, r, a, c, e
braci, b, r, a, c, i
brada, b, r, a, d, a
brade, b, r, a, d, e
bradi, b, r, a, d, i
brado, b, r, a, d, o
brago, b, r, a, g, o
brama, b, r, a, m, a
brame, b, r, a, m, e
brami, b, r, a, m, i
bramo, b, r, a, m, o
brani, b, r, a, n, i
brano, b, r, a, n, o
brava, b, r, a, v, a
brave, b, r, a, v, e
bravi, b, r, a, v, i
bravo, b, r, a, v, o
break, b, r, e, a, k
brera, b, r, e, r, a
breva, b, r, e, v, a
breve, b, r, e, v, e
brevi, b, r, e, v, i
briga, b, r, i, g, a
brina, b, r, i, n, a
brine, b, r, i, n, e
broda, b, r, o, d, a
brode, b, r, o, d, e
brodi, b, r, o, d, i
brodo, b, r, o, d, o
broli, b, r, o, l, i
brolo, b, r, o, l, o
bromi, b, r, o, m, i
bromo, b, r, o, m, o
bruci, b, r, u, c, i
bruco, b, r, u, c, o
brugi, b, r, u, g, i
brugo, b, r, u, g, o
bruma, b, r, u, m, a
brume, b, r, u, m, e
bruna, b, r, u, n, a
brune, b, r, u, n, e
bruni, b, r, u, n, i
bruno, b, r, u, n, o
bruta, b, r, u, t, a
brute, b, r, u, t, e
bruti, b, r, u, t, i
bruto, b, r, u, t, o
bruts, b, r, u, t, s
buana, b, u, a, n, a
bucce, b, u, c, c, e
buche, b, u, c, h, e
buchi, b, u, c, h, i
buffa, b, u, f, f, a
buffe, b, u, f, f, e
buffi, b, u, f, f, i
buffo, b, u, f, f, o
bugia, b, u, g, i, a
bugie, b, u, g, i, e
bugio, b, u, g, i, o
bugna, b, u, g, n, a
bugne, b, u, g, n, e
bugni, b, u, g, n, i
bugno, b, u, g, n, o
bulbi, b, u, l, b, i
bulbo, b, u, l, b, o
bulla, b, u, l, l, a
bulli, b, u, l, l, i
bullo, b, u, l, l, o
buona, b, u, o, n, a
buone, b, u, o, n, e
buoni, b, u, o, n, i
buono, b, u, o, n, o
burla, b, u, r, l, a
burle, b, u, r, l, e
burli, b, u, r, l, i
burlo, b, u, r, l, o
burri, b, u, r, r, i
burro, b, u, r, r, o
buses, b, u, s, e, s
bussa, b, u, s, s, a
busse, b, u, s, s, e
bussi, b, u, s, s, i
busso, b, u, s, s, o
busta, b, u, s, t, a
buste, b, u, s, t, e
busti, b, u, s, t, i
busto, b, u, s, t, o
butta, b, u, t, t, a
butti, b, u, t, t, i
butto, b, u, t, t, o
buzzi, b, u, z, z, i
buzzo, b, u, z, z, o
bwana, b, w, a, n, a
cablo, c, a, b, l, o
cacao, c, a, c, a, o
cacca, c, a, c, c, a
cacce, c, a, c, c, e
cacci, c, a, c, c, i
cachi, c, a, c, h, i
cacio, c, a, c, i, o
cadde, c, a, d, d, e
caddi, c, a, d, d, i
cader, c, a, d, e, r
cadmi, c, a, d, m, i
cadra, c, a, d, r, a
cadro, c, a, d, r, o
caffa, c, a, f, f, a
caffe, c, a, f, f, e
caffi, c, a, f, f, i
caffo, c, a, f, f, o
cagli, c, a, g, l, i
cagna, c, a, g, n, a
cagne, c, a, g, n, e
caino, c, a, i, n, o
calai, c, a, l, a, i
calar, c, a, l, a, r
calca, c, a, l, c, a
calce, c, a, l, c, e
calci, c, a, l, c, i
calco, c, a, l, c, o
calda, c, a, l, d, a
calde, c, a, l, d, e
caldi, c, a, l, d, i
caldo, c, a, l, d, o
calia, c, a, l, i, a
calie, c, a, l, i, e
calla, c, a, l, l, a
calle, c, a, l, l, e
calli, c, a, l, l, i
callo, c, a, l, l, o
calma, c, a, l, m, a
calme, c, a, l, m, e
calmi, c, a, l, m, i
calmo, c, a, l, m, o
calva, c, a, l, v, a
calve, c, a, l, v, e
calvi, c, a, l, v, i
calvo, c, a, l, v, o
calza, c, a, l, z, a
calze, c, a, l, z, e
calzi, c, a, l, z, i
calzo, c, a, l, z, o
cambi, c, a, m, b, i
camma, c, a, m, m, a
camme, c, a, m, m, e
campa, c, a, m, p, a
campi, c, a, m, p, i
campo, c, a, m, p, o
canea, c, a, n, e, a
canee, c, a, n, e, e
cangi, c, a, n, g, i
canna, c, a, n, n, a
canne, c, a, n, n, e
canoa, c, a, n, o, a
canoe, c, a, n, o, e
canta, c, a, n, t, a
canti, c, a, n, t, i
canto, c, a, n, t, o
capii, c, a, p, i, i
capoc, c, a, p, o, c
cappa, c, a, p, p, a
cappe, c, a, p, p, e
cappi, c, a, p, p, i
capra, c, a, p, r, a
capre, c, a, p, r, e
capri, c, a, p, r, i
capro, c, a, p, r, o
caput, c, a, p, u, t
carbo, c, a, r, b, o
carca, c, a, r, c, a
carco, c, a, r, c, o
carda, c, a, r, d, a
carde, c, a, r, d, e
cardi, c, a, r, d, i
cardo, c, a, r, d, o
cargo, c, a, r, g, o
caria, c, a, r, i, a
carie, c, a, r, i, e
carla, c, a, r, l, a
carlo, c, a, r, l, o
carme, c, a, r, m, e
carmi, c, a, r, m, i
carne, c, a, r, n, e
carni, c, a, r, n, i
carpa, c, a, r, p, a
carpe, c, a, r, p, e
carpi, c, a, r, p, i
carpo, c, a, r, p, o
carra, c, a, r, r, a
carre, c, a, r, r, e
carri, c, a, r, r, i
carro, c, a, r, r, o
carta, c, a, r, t, a
carte, c, a, r, t, e
casal, c, a, s, a, l
casba, c, a, s, b, a
casbe, c, a, s, b, e
casca, c, a, s, c, a
casco, c, a, s, c, o
cassa, c, a, s, s, a
casse, c, a, s, s, e
cassi, c, a, s, s, i
casso, c, a, s, s, o
casta, c, a, s, t, a
caste, c, a, s, t, e
casti, c, a, s, t, i
casto, c, a, s, t, o
casts, c, a, s, t, s
casus, c, a, s, u, s
catch, c, a, t, c, h
caule, c, a, u, l, e
cauli, c, a, u, l, i
causa, c, a, u, s, a
cause, c, a, u, s, e
causi, c, a, u, s, i
causo, c, a, u, s, o
cauta, c, a, u, t, a
caute, c, a, u, t, e
cauti, c, a, u, t, i
cauto, c, a, u, t, o
cavai, c, a, v, a, i
cavea, c, a, v, e, a
cavee, c, a, v, e, e
caves, c, a, v, e, s
cavia, c, a, v, i, a
cavie, c, a, v, i, e
cazzi, c, a, z, z, i
cazzo, c, a, z, z, o
ceche, c, e, c, h, e
cechi, c, e, c, h, i
cedri, c, e, d, r, i
cedro, c, e, d, r, o
cedua, c, e, d, u, a
cedue, c, e, d, u, e
cedui, c, e, d, u, i
ceduo, c, e, d, u, o
ceffi, c, e, f, f, i
ceffo, c, e, f, f, o
celai, c, e, l, a, i
celia, c, e, l, i, a
celie, c, e, l, i, e
cella, c, e, l, l, a
celle, c, e, l, l, e
celti, c, e, l, t, i
cenai, c, e, n, a, i
cenci, c, e, n, c, i
cenge, c, e, n, g, e
cenni, c, e, n, n, i
cenno, c, e, n, n, o
censi, c, e, n, s, i
censo, c, e, n, s, o
cento, c, e, n, t, o
cents, c, e, n, t, s
ceppa, c, e, p, p, a
ceppe, c, e, p, p, e
ceppi, c, e, p, p, i
ceppo, c, e, p, p, o
cerca, c, e, r, c, a
cerci, c, e, r, c, i
cerco, c, e, r, c, o
cerea, c, e, r, e, a
ceree, c, e, r, e, e
cerei, c, e, r, e, i
cereo, c, e, r, e, o
cerio, c, e, r, i, o
cerna, c, e, r, n, a
cerne, c, e, r, n, e
cerno, c, e, r, n, o
cerri, c, e, r, r, i
cerro, c, e, r, r, o
certa, c, e, r, t, a
certe, c, e, r, t, e
certi, c, e, r, t, i
certo, c, e, r, t, o
cerva, c, e, r, v, a
cerve, c, e, r, v, e
cervi, c, e, r, v, i
cervo, c, e, r, v, o
cesio, c, e, s, i, o
cespi, c, e, s, p, i
cespo, c, e, s, p, o
cessa, c, e, s, s, a
cessi, c, e, s, s, i
cesso, c, e, s, s, o
cesta, c, e, s, t, a
ceste, c, e, s, t, e
cesti, c, e, s, t, i
cesto, c, e, s, t, o
cetra, c, e, t, r, a
cetre, c, e, t, r, e
chefs, c, h, e, f, s
chela, c, h, e, l, a
chele, c, h, e, l, e
chepi, c, h, e, p, i
cheta, c, h, e, t, a
chete, c, h, e, t, e
cheti, c, h, e, t, i
cheto, c, h, e, t, o
chili, c, h, i, l, i
chilo, c, h, i, l, o
chimi, c, h, i, m, i
chimo, c, h, i, m, o
china, c, h, i, n, a
chine, c, h, i, n, e
chini, c, h, i, n, i
chino, c, h, i, n, o
chips, c, h, i, p, s
chocs, c, h, o, c, s
chope, c, h, o, p, e
ciack, c, i, a, c, k
ciana, c, i, a, n, a
ciane, c, i, a, n, e
ciani, c, i, a, n, i
ciano, c, i, a, n, o
cicca, c, i, c, c, a
cicce, c, i, c, c, e
cicli, c, i, c, l, i
ciclo, c, i, c, l, o
cieca, c, i, e, c, a
cieco, c, i, e, c, o
cieli, c, i, e, l, i
cielo, c, i, e, l, o
cifra, c, i, f, r, a
cifre, c, i, f, r, e
cigli, c, i, g, l, i
cigna, c, i, g, n, a
cigne, c, i, g, n, e
cigni, c, i, g, n, i
cigno, c, i, g, n, o
cince, c, i, n, c, e
cinge, c, i, n, g, e
cinse, c, i, n, s, e
cinsi, c, i, n, s, i
cinta, c, i, n, t, a
cinte, c, i, n, t, e
cinti, c, i, n, t, i
cinto, c, i, n, t, o
cintz, c, i, n, t, z
cippi, c, i, p, p, i
cippo, c, i, p, p, o
cipro, c, i, p, r, o
circa, c, i, r, c, a
circe, c, i, r, c, e
circi, c, i, r, c, i
circo, c, i, r, c, o
cirri, c, i, r, r, i
cirro, c, i, r, r, o
cispa, c, i, s, p, a
cispe, c, i, s, p, e
cista, c, i, s, t, a
ciste, c, i, s, t, e
cisti, c, i, s, t, i
citai, c, i, t, a, i
citta, c, i, t, t, a
ciuco, c, i, u, c, o
civet, c, i, v, e, t
clans, c, l, a, n, s
class, c, l, a, s, s
clava, c, l, a, v, a
clave, c, l, a, v, e
cleri, c, l, e, r, i
clero, c, l, e, r, o
cleto, c, l, e, t, o
clima, c, l, i, m, a
climi, c, l, i, m, i
cline, c, l, i, n, e
clini, c, l, i, n, i
clips, c, l, i, p, s
clivi, c, l, i, v, i
clivo, c, l, i, v, o
clone, c, l, o, n, e
cloni, c, l, o, n, i
clono, c, l, o, n, o
clori, c, l, o, r, i
cloro, c, l, o, r, o
clous, c, l, o, u, s
clown, c, l, o, w, n
clubs, c, l, u, b, s
coana, c, o, a, n, a
coane, c, o, a, n, e
cobra, c, o, b, r, a
cocca, c, o, c, c, a
cocce, c, o, c, c, e
cocci, c, o, c, c, i
cocco, c, o, c, c, o
coche, c, o, c, h, e
codio, c, o, d, i, o
coeva, c, o, e, v, a
coeve, c, o, e, v, e
coevi, c, o, e, v, i
coevo, c, o, e, v, o
coffa, c, o, f, f, a
coffe, c, o, f, f, e
cogli, c, o, g, l, i
coiti, c, o, i, t, i
coito, c, o, i, t, o
colai, c, o, l, a, i
colei, c, o, l, e, i
colga, c, o, l, g, a
colgo, c, o, l, g, o
colla, c, o, l, l, a
colle, c, o, l, l, e
colli, c, o, l, l, i
collo, c, o, l, l, o
colma, c, o, l, m, a
colme, c, o, l, m, e
colmi, c, o, l, m, i
colmo, c, o, l, m, o
colon, c, o, l, o, n
color, c, o, l, o, r
colpa, c, o, l, p, a
colpe, c, o, l, p, e
colpi, c, o, l, p, i
colpo, c, o, l, p, o
colse, c, o, l, s, e
colsi, c, o, l, s, i
colta, c, o, l, t, a
colte, c, o, l, t, e
colti, c, o, l, t, i
colto, c, o, l, t, o
colui, c, o, l, u, i
colza, c, o, l, z, a
colze, c, o, l, z, e
comma, c, o, m, m, a
commi, c, o, m, m, i
compi, c, o, m, p, i
conca, c, o, n, c, a
conce, c, o, n, c, e
conci, c, o, n, c, i
condi, c, o, n, d, i
conga, c, o, n, g, a
congo, c, o, n, g, o
conia, c, o, n, i, a
conio, c, o, n, i, o
conta, c, o, n, t, a
conte, c, o, n, t, e
conti, c, o, n, t, i
conto, c, o, n, t, o
copia, c, o, p, i, a
copie, c, o, p, i, e
copio, c, o, p, i, o
coppa, c, o, p, p, a
coppe, c, o, p, p, e
coppi, c, o, p, p, i
coppo, c, o, p, p, o
copra, c, o, p, r, a
copre, c, o, p, r, e
copri, c, o, p, r, i
copro, c, o, p, r, o
coque, c, o, q, u, e
coram, c, o, r, a, m
corba, c, o, r, b, a
corbe, c, o, r, b, e
corda, c, o, r, d, a
corde, c, o, r, d, e
corea, c, o, r, e, a
coree, c, o, r, e, e
cormi, c, o, r, m, i
cormo, c, o, r, m, o
corna, c, o, r, n, a
corni, c, o, r, n, i
corno, c, o, r, n, o
corpi, c, o, r, p, i
corpo, c, o, r, p, o
corra, c, o, r, r, a
corre, c, o, r, r, e
corri, c, o, r, r, i
corro, c, o, r, r, o
corsa, c, o, r, s, a
corse, c, o, r, s, e
corsi, c, o, r, s, i
corso, c, o, r, s, o
corta, c, o, r, t, a
corte, c, o, r, t, e
corti, c, o, r, t, i
corto, c, o, r, t, o
corve, c, o, r, v, e
corvi, c, o, r, v, i
corvo, c, o, r, v, o
cosca, c, o, s, c, a
cosce, c, o, s, c, e
cosci, c, o, s, c, i
cosfi, c, o, s, f, i
cosmi, c, o, s, m, i
cosmo, c, o, s, m, o
cosse, c, o, s, s, e
cossi, c, o, s, s, i
cosso, c, o, s, s, o
costa, c, o, s, t, a
coste, c, o, s, t, e
costi, c, o, s, t, i
costo, c, o, s, t, o
cotta, c, o, t, t, a
cotte, c, o, t, t, e
cotti, c, o, t, t, i
cotto, c, o, t, t, o
coupe, c, o, u, p, e
court, c, o, u, r, t
covai, c, o, v, a, i
cover, c, o, v, e, r
cozie, c, o, z, i, e
cozza, c, o, z, z, a
cozze, c, o, z, z, e
cozzi, c, o, z, z, i
cozzo, c, o, z, z, o
crani, c, r, a, n, i
crapa, c, r, a, p, a
crasi, c, r, a, s, i
crawl, c, r, a, w, l
creai, c, r, e, a, i
cream, c, r, e, a, m
creda, c, r, e, d, a
crede, c, r, e, d, e
credi, c, r, e, d, i
credo, c, r, e, d, o
crema, c, r, e, m, a
creme, c, r, e, m, e
cremi, c, r, e, m, i
cremo, c, r, e, m, o
crepa, c, r, e, p, a
crepe, c, r, e, p, e
crepi, c, r, e, p, i
crepo, c, r, e, p, o
cresi, c, r, e, s, i
creso, c, r, e, s, o
creta, c, r, e, t, a
crete, c, r, e, t, e
crine, c, r, i, n, e
crini, c, r, i, n, i
crisi, c, r, i, s, i
croce, c, r, o, c, e
croci, c, r, o, c, i
croco, c, r, o, c, o
croda, c, r, o, d, a
crode, c, r, o, d, e
croma, c, r, o, m, a
crome, c, r, o, m, e
cromi, c, r, o, m, i
cromo, c, r, o, m, o
crono, c, r, o, n, o
cross, c, r, o, s, s
crown, c, r, o, w, n
cruda, c, r, u, d, a
crude, c, r, u, d, e
crudi, c, r, u, d, i
crudo, c, r, u, d, o
cruna, c, r, u, n, a
crune, c, r, u, n, e
cubia, c, u, b, i, a
cubie, c, u, b, i, e
cucce, c, u, c, c, e
cucco, c, u, c, c, o
cuccu, c, u, c, c, u
cucio, c, u, c, i, o
cuius, c, u, i, u, s
culla, c, u, l, l, a
culle, c, u, l, l, e
culli, c, u, l, l, i
cullo, c, u, l, l, o
culmi, c, u, l, m, i
culmo, c, u, l, m, o
culpa, c, u, l, p, a
culti, c, u, l, t, i
culto, c, u, l, t, o
cunei, c, u, n, e, i
cuneo, c, u, n, e, o
cuoca, c, u, o, c, a
cuoci, c, u, o, c, i
cuoco, c, u, o, c, o
cuoia, c, u, o, i, a
cuoio, c, u, o, i, o
cuore, c, u, o, r, e
cuori, c, u, o, r, i
curai, c, u, r, a, i
curia, c, u, r, i, a
curie, c, u, r, i, e
curio, c, u, r, i, o
curry, c, u, r, r, y
curva, c, u, r, v, a
curve, c, u, r, v, e
curvi, c, u, r, v, i
